id,name,known_as,image_url,birth_year,birth_location,murder_count_proved,murder_count_actual,victim_stats,country,years_active_from,years_active_to,active_in_provinces,method,sentence_details,motive,additional_info,status,caught_by,source_url,scraped_at
154,Boston Strangler,,,,,13,13,"{""proved_victims"": 13, ""possible_victims"": 13, ""female"": 0, ""male"": 0, ""under_18"": 0, ""18_30"": 0, ""31_45"": 0, ""46_60"": 0, ""above_60"": 0, ""major_occupation"": null}",United States,,,,,,,"The Boston Strangler is the murderer of 13 women in Greater Boston during the early 1960s. The crimes were attributed to Albert DeSalvo (1931–1973) based on his confession, on details revealed in court during a separate case, and DNA evidence linking him to the final victim.",,,https://en.wikipedia.org/wiki/Boston_Strangler,2026-07-05T16:24:11.748392+00:00
155,Herbert Mullin,,https://upload.wikimedia.org/wikipedia/commons/thumb/7/7a/Herbert_Mullin.jpg/250px-Herbert_Mullin.jpg,1947,U.S.,13,13,"{""proved_victims"": 13, ""possible_victims"": 13, ""female"": 0, ""male"": 0, ""under_18"": 0, ""18_30"": 0, ""31_45"": 0, ""46_60"": 0, ""above_60"": 0, ""major_occupation"": null}",United States,,,,,Deceased,,"Herbert William Mullin (April 18, 1947 – August 18, 2022) was an American serial killer who killed 13 people in California in the early 1970s. He confessed to the killings, which he claimed prevented earthquakes . In 1973, after a trial to determine whether he was legally insane or culpable , he was convicted of two murders in the first-degree and nine in the second-degree and sentenced to life imprisonment . During his imprisonment, he was denied parole eight times.",,,https://en.wikipedia.org/wiki/Herbert_Mullin,2026-07-05T16:24:14.638608+00:00
156,Vladimir Storozhenko,,,1953,Soviet Union,13,13,"{""proved_victims"": 13, ""possible_victims"": 13, ""female"": 0, ""male"": 0, ""under_18"": 0, ""18_30"": 0, ""31_45"": 0, ""46_60"": 0, ""above_60"": 0, ""major_occupation"": null}",Soviet Union,,,,,Murder with aggravating circumstances,,"Vladimir Viktorovich Storozhenko ( Russian : Влади́мир Ви́кторович Стороже́нко ; 11 April 1953 – 22 September 1982), known as The Smolensk Strangler ( Russian : Смоленский душитель ), was a Soviet serial killer .",,,https://en.wikipedia.org/wiki/Vladimir_Storozhenko,2026-07-05T16:24:17.505254+00:00
157,Johannes Mashiane,,,,South Africa,13,13,"{""proved_victims"": 13, ""possible_victims"": 13, ""female"": 0, ""male"": 0, ""under_18"": 0, ""18_30"": 0, ""31_45"": 0, ""46_60"": 0, ""above_60"": 0, ""major_occupation"": null}",South Africa,,,"[""Atteridgeville""]",,,,"Johannes Mashiane , nicknamed The Beast of Atteridgeville , was a South African rapist and serial killer active in the 1980s. He killed 13 people in Atteridgeville , South Africa, before he died in 1989.",,,https://en.wikipedia.org/wiki/Johannes_Mashiane,2026-07-05T16:24:19.806174+00:00
158,Vasiliy Kulik,"[""\""The Irkutsk Monster\"" \""The Murder Doctor\"" \""The Murderer\""""]",https://upload.wikimedia.org/wikipedia/en/thumb/1/13/VasiliyKulik.png/250px-VasiliyKulik.png,1956,Soviet Union,13,13,"{""proved_victims"": 13, ""possible_victims"": 13, ""female"": 0, ""male"": 0, ""under_18"": 0, ""18_30"": 0, ""31_45"": 0, ""46_60"": 0, ""above_60"": 0, ""major_occupation"": null}",Soviet Union,,,"[""Irkutsk"", ""Kirovohrad""]",,,,Vasiliy Sergeyevich Kulik ( Russian : Василий Серге́евич Кулик ; 17 January 1956 – 26 June 1989) was a Soviet serial killer convicted for the killing of 13 people and nearly 30 rapes in Irkutsk between 1984 and 1986.,,,https://en.wikipedia.org/wiki/Vasiliy_Kulik,2026-07-05T16:24:22.232485+00:00
159,Nikolai Dudin,"[""\""The Grim Maniac\"" \""The Furmanov Chikatilo \""""]",,1973,Soviet Union,13,13,"{""proved_victims"": 13, ""possible_victims"": 13, ""female"": 0, ""male"": 0, ""under_18"": 0, ""18_30"": 0, ""31_45"": 0, ""46_60"": 0, ""above_60"": 0, ""major_occupation"": null}","Soviet Union , later Russia",,,,,Murder,,"Nikolai Arkadievich Dudin ( Russian : Никола́й Арка́дьевич Ду́дин ; born 22 December 1973), known as The Grim Maniac ( Russian : Обидчивый маньяк ), is a Soviet - Russian serial killer who killed 13 people in the town of Furmanov between 1987 and 2002.",,,https://en.wikipedia.org/wiki/Nikolai_Dudin,2026-07-05T16:24:24.791813+00:00
160,Mukosi Freddy Mulaudzi,,,1962,South Africa,13,13,"{""proved_victims"": 13, ""possible_victims"": 13, ""female"": 0, ""male"": 0, ""under_18"": 0, ""18_30"": 0, ""31_45"": 0, ""46_60"": 0, ""above_60"": 0, ""major_occupation"": null}",South Africa,,,,,Murder,,"Mukosi Freddy Mulaudzi (born 1962), known as The Limpopo Serial Killer , is a South African robber, rapist and serial killer who murdered a total of 13 people from 1990 to 2006, until his capture in July 2006. He was given 11 life sentences for his crimes.",,,https://en.wikipedia.org/wiki/Mukosi_Freddy_Mulaudzi,2026-07-05T16:24:27.320392+00:00
161,Duan Guocheng,,,1973,China,13,13,"{""proved_victims"": 13, ""possible_victims"": 13, ""female"": 0, ""male"": 0, ""under_18"": 0, ""18_30"": 0, ""31_45"": 0, ""46_60"": 0, ""above_60"": 0, ""major_occupation"": null}",China,,,"[""Hunan"", ""Hubei""]",,Murder x13,,"Duan Guocheng (1973 – 24 April 2003) was a Chinese serial killer and robber who murdered 13 women in Hubei and Hunan between 1999 and 2001. Additionally, he committed fourteen assaults and over forty other robberies during the same timeframe. Duan was arrested in 2001 following a three-month manhunt and executed in 2003.",,,https://en.wikipedia.org/wiki/Duan_Guocheng,2026-07-05T16:24:30.392163+00:00
162,Nikolay Shubin,"[""\""The Cemetery Director\"" \""Valre Bomzh\"" \""The Chess Player\""""]",,1956,Soviet Union,13,13,"{""proved_victims"": 13, ""possible_victims"": 13, ""female"": 0, ""male"": 0, ""under_18"": 0, ""18_30"": 0, ""31_45"": 0, ""46_60"": 0, ""above_60"": 0, ""major_occupation"": null}",Russia,,,,,Murder,,"Nikolay Pavlovich Shubin ( Russian : Николай Павлович Шубин ; born 1956), known as The Cemetery Director , is a Georgian-born Russian serial killer , who killed 13 homeless and single people between 2004 and 2006 in the city of Lipetsk .",,,https://en.wikipedia.org/wiki/Nikolay_Shubin,2026-07-05T16:24:33.194561+00:00
163,Thozamile Taki,,,1971,South Africa,13,13,"{""proved_victims"": 13, ""possible_victims"": 13, ""female"": 0, ""male"": 0, ""under_18"": 0, ""18_30"": 0, ""31_45"": 0, ""46_60"": 0, ""above_60"": 0, ""major_occupation"": null}",South Africa,,,,,,,"Thozamile Taki (born 1971), known as The Sugarcane Killer , is a South African serial killer who killed 13 women aged 18–25, dumping their bodies in agricultural plantations. On 19 January 2011, Taki was sentenced to 13 life sentences for the murders and an additional 208 years, 16 years for each of his victims of armed robbery.",,,https://en.wikipedia.org/wiki/Thozamile_Taki,2026-07-05T16:24:36.198792+00:00
164,Rainbow Maniac,,,,,13,13,"{""proved_victims"": 13, ""possible_victims"": 13, ""female"": 0, ""male"": 0, ""under_18"": 0, ""18_30"": 0, ""31_45"": 0, ""46_60"": 0, ""above_60"": 0, ""major_occupation"": null}",Brazil,,,,,,,"The Paturis Park murders are a series of 13 murders of gay men committed between July 2007 and August 2008. The murders took place in Paturis Park (""Parque dos Paturis"") in Carapicuíba , Brazil , and were perpetrated by an unidentified serial killer who has been dubbed the ""Rainbow Maniac"".",,,https://en.wikipedia.org/wiki/Paturis_Park_murders,2026-07-05T16:24:38.808308+00:00
165,Li Wenxiang,,,1952,China [ 1 ],13,,"{""proved_victims"": 13, ""possible_victims"": null, ""female"": 0, ""male"": 0, ""under_18"": 0, ""18_30"": 0, ""31_45"": 0, ""46_60"": 0, ""above_60"": 0, ""major_occupation"": null}",China,,,"[""Guangzhou""]",,,,"Li Wenxiang ( Chinese : 李文香 ; pinyin : Lǐ Wénxiāng ; 1952 – after 1996), sometimes mistransliterated Li Wenxian and also known as the Guangzhou Ripper , was a Chinese serial killer who was active between 1991 and 1996 in Guangzhou , China. He killed 13 women and was sentenced to death.",,,https://en.wikipedia.org/wiki/Li_Wenxiang,2026-07-05T16:24:41.455289+00:00
166,Adolf Seefeldt,"[""\""The Sandman\"" \""Uncle Tick Tock\"" \""Uncle Adi\"" Adolf Seefeld""]",https://upload.wikimedia.org/wikipedia/en/thumb/8/81/Adolf_Seefeldt.jpeg/250px-Adolf_Seefeldt.jpeg,,North German Confederation,12,100,"{""proved_victims"": 12, ""possible_victims"": 100, ""female"": 0, ""male"": 0, ""under_18"": 0, ""18_30"": 0, ""31_45"": 0, ""46_60"": 0, ""above_60"": 0, ""major_occupation"": null}","German Empire , Weimar Republic , Nazi Germany (now Germany )",,,,,Murder,,"Adolf Gustav Seefeldt (6 March 1870 – 23 May 1936), known as The Sandman , was a German serial killer .",,,https://en.wikipedia.org/wiki/Adolf_Seefeldt,2026-07-05T16:24:43.781804+00:00
167,José Manuel Martínez,,https://upload.wikimedia.org/wikipedia/commons/thumb/0/00/Josemanuelmartinezmugshot.jpg/250px-Josemanuelmartinezmugshot.jpg,1962,U.S.,12,36,"{""proved_victims"": 12, ""possible_victims"": 36, ""female"": 0, ""male"": 0, ""under_18"": 0, ""18_30"": 0, ""31_45"": 0, ""46_60"": 0, ""above_60"": 0, ""major_occupation"": null}",,19,20,"[""Alabama"", ""California"", ""and Florida (convicted) 9 others (claimed)""]",,,,"José Manuel Martínez (born June 13, 1962), dubbed El Mano Negra (""The Black Hand"") is a Mexican-American former self-described drug cartel hitman . Martínez confessed to an estimated 36 murders and was sentenced to life in prison after being convicted of murder in multiple states. He is incarcerated at USP Victorville in California.",,,https://en.wikipedia.org/wiki/José_Manuel_Martínez_(serial_killer),2026-07-05T16:24:46.259470+00:00
168,Charles Sobhraj,"[""Bikini Killer Splitting Killer The Serpent""]",https://upload.wikimedia.org/wikipedia/commons/thumb/1/12/Charles_Sobhraj_statue_%28cropped%29.jpg/250px-Charles_Sobhraj_statue_%28cropped%29.jpg,1944,French Indochina,12,30,"{""proved_victims"": 12, ""possible_victims"": 30, ""female"": 0, ""male"": 0, ""under_18"": 0, ""18_30"": 0, ""31_45"": 0, ""46_60"": 0, ""above_60"": 0, ""major_occupation"": null}","Thailand, Nepal, India, Malaysia, France, Afghanistan, Turkey, Greece",,,,,Guilty [ a ],,"Charles Sobhraj (born Hotchand Bhawnani Gurmukh Sobhraj ; 6 April 1944) is a French serial killer , fraudster , and thief whose victims were mainly Western tourists travelling on the hippie trail of South Asia during the 1970s. He is of Sindhi and Vietnamese origin. He was known as the Bikini Killer because of the attire of several of his victims, as well as the Splitting Killer and the Serpent for ""his snake-like ability to avoid detection by authorities"".",,,https://en.wikipedia.org/wiki/Charles_Sobhraj,2026-07-05T16:24:48.322571+00:00
169,Bruce George Peter Lee,,,1960,England,12,26,"{""proved_victims"": 12, ""possible_victims"": 26, ""female"": 0, ""male"": 0, ""under_18"": 0, ""18_30"": 0, ""31_45"": 0, ""46_60"": 0, ""above_60"": 0, ""major_occupation"": null}",England,,,"[""East Riding of Yorkshire""]",,,,"Peter Tredget (born Peter George Dinsdale ; 31 July 1960), formerly Bruce George Peter Lee , is a British serial killer and arsonist . He confessed to a total of 11 acts of arson , pleading guilty to 26 counts of manslaughter. Fourteen of these were overturned in two separate appeals . Lee was sentenced to indefinite secure hospital detention in 1981 and remains detained as of March 2026.",,,https://en.wikipedia.org/wiki/Bruce_George_Peter_Lee,2026-07-05T16:24:51.116727+00:00
170,Slamet Tohari,,,1977,Slamet Tohari c. 1977 (age 48 – 49) Indonesia,12,24,"{""proved_victims"": 12, ""possible_victims"": 24, ""female"": 0, ""male"": 0, ""under_18"": 0, ""18_30"": 0, ""31_45"": 0, ""46_60"": 0, ""above_60"": 0, ""major_occupation"": null}",Indonesia,,,,,Murder (12 counts),,"Slamet Tohari (born c. 1977) is an Indonesian serial killer and scammer who fatally poisoned at least 12 people in Banjarnegara , Central Java, between 2020 and 2023.",,,https://en.wikipedia.org/wiki/Slamet_Tohari,2026-07-05T16:24:53.617374+00:00
171,Vladimir Romanov,"[""\""The Kaliningrad Maniac\"" \""The Bagrationvosky Maniac\"" \""The Taxi Driver\""""]",,1950,RSFSR,12,20,"{""proved_victims"": 12, ""possible_victims"": 20, ""female"": 0, ""male"": 0, ""under_18"": 0, ""18_30"": 0, ""31_45"": 0, ""46_60"": 0, ""above_60"": 0, ""major_occupation"": null}","Soviet Union , later Russia",,,,,Murder,,"Vladimir Ivanovich Romanov ( Russian : Владимир Иванович Романов ; 5 December 1950 – 12 October 2006), known as the Kaliningrad Maniac ( Russian : Калининградский маньяк , romanized : Kaliningradsky manyak ), was a Soviet - Russian serial killer and child rapist. Between 1991 and 2005, he committed at least 12 murders associated with rape.",,,https://en.wikipedia.org/wiki/Vladimir_Romanov_(serial_killer),2026-07-05T16:24:56.031839+00:00
172,Maury Travis,"[""The Streetwalker Strangler The Bi-State Strangler""]",https://upload.wikimedia.org/wikipedia/en/thumb/7/75/Maury_Travis.jpg/250px-Maury_Travis.jpg,1965,U.S.,12,17,"{""proved_victims"": 12, ""possible_victims"": 17, ""female"": 0, ""male"": 0, ""under_18"": 0, ""18_30"": 0, ""31_45"": 0, ""46_60"": 0, ""above_60"": 0, ""major_occupation"": null}",United States,,,,,15 years (robbery; paroled in 1994) Two years probation (drug offenses) [ 1 ],,"Maury Troy Travis (October 25, 1965 – June 10, 2002) was an American serial killer . Travis was named in a federal criminal complaint for the murders of two women. At the time of the murders, he was a hotel waiter, and on parole for a 1989 robbery . While Travis claimed in a letter to have murdered 17 women, some authorities were doubtful; others thought he may have murdered up to 20 women. He committed suicide by hanging in custody in St. Louis County, Missouri , after being arrested for murder.",,,https://en.wikipedia.org/wiki/Maury_Travis,2026-07-05T16:24:58.649910+00:00
173,Dennis Nilsen,,https://upload.wikimedia.org/wikipedia/en/5/51/Dennis_Nilsen.jpg,1945,Scotland,12,15,"{""proved_victims"": 12, ""possible_victims"": 15, ""female"": 0, ""male"": 0, ""under_18"": 0, ""18_30"": 0, ""31_45"": 0, ""46_60"": 0, ""above_60"": 0, ""major_occupation"": null}",United Kingdom,,,,,,,"Dennis Andrew Nilsen (23 November 1945 – 12 May 2018) was a Scottish serial killer and necrophile who murdered at least twelve young men and boys between 1978 and 1983. Convicted at the Old Bailey of six counts of murder and two of attempted murder , Nilsen was sentenced to life imprisonment on 4 November 1983, with a recommendation that he serve a minimum of 25 years; this recommendation was later changed to a whole life tariff in December 1994. In his later years, Nilsen was imprisoned at HM Prison Full Sutton in the East Riding of Yorkshire .",,,https://en.wikipedia.org/wiki/Dennis_Nilsen,2026-07-05T16:25:00.976946+00:00
174,Kenneth Bianchi,,https://upload.wikimedia.org/wikipedia/commons/thumb/d/d9/KennethBianchi_1979.jpg/250px-KennethBianchi_1979.jpg,1951,U.S.,12,15,"{""proved_victims"": 12, ""possible_victims"": 15, ""female"": 0, ""male"": 0, ""under_18"": 0, ""18_30"": 0, ""31_45"": 0, ""46_60"": 0, ""above_60"": 0, ""major_occupation"": null}",United States,,,"[""California Washington""]",,,Sexual sadism,"Kenneth Alessio Bianchi ( / ˈ b iː æ n k iː / ; born May 22, 1951) is an American serial killer , kidnapper , and rapist . He is known for the Hillside Strangler murders which he committed with his cousin Angelo Buono Jr. in Los Angeles , as well as for two more murders in Washington State as the sole perpetrator. Bianchi is currently serving a sentence of life imprisonment in Washington State Penitentiary for these crimes. He was also at one time a suspect in the Alphabet murders , three unsolved murders in his home city of Rochester, New York , from 1971 to 1973. Bianchi was most recently denied parole in 2025.",,,https://en.wikipedia.org/wiki/Kenneth_Bianchi,2026-07-05T16:25:03.318042+00:00
175,Enriqueta Martí,,https://upload.wikimedia.org/wikipedia/commons/thumb/b/b5/Enriqueta_Mart%C3%AD.jpg/250px-Enriqueta_Mart%C3%AD.jpg,,Kingdom of Spain (Savoy),12,12,"{""proved_victims"": 12, ""possible_victims"": 12, ""female"": 0, ""male"": 0, ""under_18"": 0, ""18_30"": 0, ""31_45"": 0, ""46_60"": 0, ""above_60"": 0, ""major_occupation"": null}",,19,19,,,"Serial killer , kidnapper and procuress",,"Enriqueta Martí Ripollés (1868 – 12 May 1913) was a Spanish child serial killer , kidnapper, prostitute and procuress of children. She was called ""The Vampire of carrer Ponent"", ""The Vampire of Barcelona"" and ""The Vampire of the Raval"" in the press.",,,https://en.wikipedia.org/wiki/Enriqueta_Martí,2026-07-05T16:25:06.311357+00:00
176,Abdallah al-Hubal,,,1955,1955 Yemen,12,12,"{""proved_victims"": 12, ""possible_victims"": 12, ""female"": 0, ""male"": 0, ""under_18"": 0, ""18_30"": 0, ""31_45"": 0, ""46_60"": 0, ""above_60"": 0, ""major_occupation"": null}",Yemen,,,,,,,Abdallah al-Hubal (1955 – 16 August 1998 ) was a Yemeni serial killer .,,,https://en.wikipedia.org/wiki/Abdallah_al-Hubal,2026-07-05T16:25:08.670998+00:00
177,Nikolai Shestakov,,https://upload.wikimedia.org/wikipedia/en/1/19/NikolaiShestakov.jpg,1954,Nikolai Porfirievich Shestakov 1954 ( 1954 ) RSFSR,12,12,"{""proved_victims"": 12, ""possible_victims"": 12, ""female"": 0, ""male"": 0, ""under_18"": 0, ""18_30"": 0, ""31_45"": 0, ""46_60"": 0, ""above_60"": 0, ""major_occupation"": null}",Soviet Union,,,,,Murder with aggravating circumstances,,"Nikolai Porfirievich Shestakov ( Russian : Никола́й Порфи́рьевич Шестако́в ; 1954–1978), known as The Luberetsky Maniac ( Russian : Люберецкий маньяк ), was a Soviet serial killer and rapist who worked as a truck driver.",,,https://en.wikipedia.org/wiki/Nikolai_Shestakov_(serial_killer),2026-07-05T16:25:11.281679+00:00
178,Joseph Christopher,"[""The .22-Caliber Killer The Midtown Slasher""]",https://upload.wikimedia.org/wikipedia/en/thumb/5/5a/Josephgchristopher.jpg/250px-Josephgchristopher.jpg,1955,U.S.,12,12,"{""proved_victims"": 12, ""possible_victims"": 12, ""female"": 0, ""male"": 0, ""under_18"": 0, ""18_30"": 0, ""31_45"": 0, ""46_60"": 0, ""above_60"": 0, ""major_occupation"": null}",United States,,,"[""New York"", ""Georgia""]",,Second degree murder (3 counts),Racism [ 1 ],"Joseph Gerard Christopher (July 26, 1955 – March 1, 1993), also known as the Midtown Slasher and the .22 Caliber Killer , was an American serial killer who committed a series of stabbings and shootings against African American men and boys, killing twelve and injuring seven, between 1980 and 1981 in various New York cities and towns.",,,https://en.wikipedia.org/wiki/Joseph_Christopher,2026-07-05T16:25:13.258137+00:00
179,"""Paraquat murders"" killer",,https://upload.wikimedia.org/wikipedia/commons/thumb/a/af/Drink_vending_machine_at_Narita_Airport.jpg/250px-Drink_vending_machine_at_Narita_Airport.jpg,,,12,12,"{""proved_victims"": 12, ""possible_victims"": 12, ""female"": 0, ""male"": 0, ""under_18"": 0, ""18_30"": 0, ""31_45"": 0, ""46_60"": 0, ""above_60"": 0, ""major_occupation"": null}",,,,"[""Japan""]",,,,"The paraquat murders ( パラコート連続毒殺事件 , Parakōto renzoku dokusatsu jiken ) were a series of indiscriminate beverage poisonings carried out in western and central Japan in 1985. The drinks were placed in and around vending machines , where the victim would consume the beverage. All the beverages were poisoned with the herbicide paraquat dichloride , except for one which was poisoned with diquat . The most targeted beverages were the energy drinks Oronamin C and Real Gold. The first known case was on April 30, in Fukuyama . At least 13 people died and 35 became seriously ill, in what is possibly the deadliest product-tampering case in history. Warning labels and leaflets were posted around Tokyo , and on many of the 5.2 million vending machines across Japan. Police were unable to gather any evidence about the murders, and the case remains unsolved.",,,https://en.wikipedia.org/wiki/Paraquat_murders,2026-07-05T16:25:15.257139+00:00
180,Siswanto,,,1963,Siswanto 1963 Indonesia,12,,"{""proved_victims"": 12, ""possible_victims"": null, ""female"": 0, ""male"": 0, ""under_18"": 0, ""18_30"": 0, ""31_45"": 0, ""46_60"": 0, ""above_60"": 0, ""major_occupation"": null}",Indonesia,,,,,Murder,,"Siswanto (1963 – 26 March 2007), also known as Robot Gedek , was an Indonesian serial killer who killed and mutilated twelve boys.",,,https://en.wikipedia.org/wiki/Siswanto_(serial_killer),2026-07-05T16:25:17.825054+00:00
181,Sergey Golovkin,"[""The Fisher The Boa Chikatilo 's Apprentice""]",https://upload.wikimedia.org/wikipedia/en/thumb/3/38/Sergey_Golovkin_%28murderer%29.png/250px-Sergey_Golovkin_%28murderer%29.png,1959,Soviet Union,11,40,"{""proved_victims"": 11, ""possible_victims"": 40, ""female"": 0, ""male"": 0, ""under_18"": 0, ""18_30"": 0, ""31_45"": 0, ""46_60"": 0, ""above_60"": 0, ""major_occupation"": null}","Soviet Union, Russia",,,,,Murder with aggravating circumstances (11 counts),,"Sergey Aleksandrovich Golovkin ( Russian : Серге́й Александрович Головкин ; 26 November 1959 – 2 August 1996) was a Soviet-Russian serial killer , rapist and necrophile, convicted for the killing of 11 boys between the ages of 10 and 16 in the Moscow area between 1986 and 1992. Golovkin, also known as Fisher and The Boa , tortured , raped and killed young boys in his garage basement and the forests outside Moscow.",,,https://en.wikipedia.org/wiki/Sergey_Golovkin,2026-07-05T16:25:20.889939+00:00
182,Tiago Henrique Gomes da Rocha,,,1988,Brazil,11,39,"{""proved_victims"": 11, ""possible_victims"": 39, ""female"": 0, ""male"": 0, ""under_18"": 0, ""18_30"": 0, ""31_45"": 0, ""46_60"": 0, ""above_60"": 0, ""major_occupation"": null}",Brazil,,,,,,,"Tiago Henrique Gomes da Rocha (born 4 February 1988) is a Brazilian former security guard and serial killer who has claimed to have killed 39 people. He approached his victims on a motorbike and shouted ""robbery"" before shooting them. However, he never took anything. He targeted homeless people, women and homosexuals in Goiás . Sixteen of his victims were female, with the youngest being a 14-year-old girl whom he killed in January 2014.",,,https://en.wikipedia.org/wiki/Tiago_Henrique_Gomes_da_Rocha,2026-07-05T16:25:23.734910+00:00
183,Herb Baumeister,,https://upload.wikimedia.org/wikipedia/en/thumb/1/11/Herbert_Richard_Baumeister_%28serial_killer%29.png/250px-Herbert_Richard_Baumeister_%28serial_killer%29.png,1947,U.S.,11,23,"{""proved_victims"": 11, ""possible_victims"": 23, ""female"": 0, ""male"": 0, ""under_18"": 0, ""18_30"": 0, ""31_45"": 0, ""46_60"": 0, ""above_60"": 0, ""major_occupation"": null}",United States,,,"[""Indiana"", ""possibly Ohio""]",,Deceased,,"Herbert Richard Baumeister (April 7, 1947 – July 3, 1996) was an American businessman and serial killer who came under suspicion of murdering over a dozen men in the early-to-mid 1990s, most of whom were last seen at gay bars in central Indiana . Police ultimately found the remains of eleven men, eight identified, on Baumeister's property. He died by suicide after a warrant was issued for his arrest. Since his death, he has come under suspicion for the murders of twelve other men along Interstate 70 in Indiana and Ohio , which occurred from the early 1980s to the early 1990s.",,,https://en.wikipedia.org/wiki/Herb_Baumeister,2026-07-05T16:25:26.457963+00:00
184,Zhang Yongming,"[""The Cannibal Killer Cannibal Monster""]",https://upload.wikimedia.org/wikipedia/en/thumb/7/70/Zhang_Yongming.jpg/250px-Zhang_Yongming.jpg,1956,China,11,17,"{""proved_victims"": 11, ""possible_victims"": 17, ""female"": 0, ""male"": 0, ""under_18"": 0, ""18_30"": 0, ""31_45"": 0, ""46_60"": 0, ""above_60"": 0, ""major_occupation"": null}",China,,,,,,,"Zhang Yongming ( Chinese : 张 永 明 ; 1956 – 10 January 2013) was a Chinese serial killer and cannibal who was convicted of, and subsequently confessed to, the murder of 11 people between March 2008 and April 2012, in what became known as the Jinning serial murder case [ zh ] . He was executed on 10 January 2013.",,,https://en.wikipedia.org/wiki/Zhang_Yongming,2026-07-05T16:25:29.055977+00:00
185,Jack Unterweger,,,1950,Allied-occupied Austria,11,15,"{""proved_victims"": 11, ""possible_victims"": 15, ""female"": 0, ""male"": 0, ""under_18"": 0, ""18_30"": 0, ""31_45"": 0, ""46_60"": 0, ""above_60"": 0, ""major_occupation"": null}","Austria , West Germany , Czechoslovakia , United States",,,,,,,"Johann "" Jack "" Unterweger (16 August 1950 – 29 June 1994) was an Austrian serial killer who committed at least twelve murders in Austria, West Germany , Czechoslovakia and the United States.",,,https://en.wikipedia.org/wiki/Jack_Unterweger,2026-07-05T16:25:32.496306+00:00
186,Vitaly Manishin,"[""\""The Barnaul Maniac\"" \""The University Maniac\"" \""The Polytechnic Maniac\"" \""The Bloody Rector\"" \""The Tutor\""""]",,1971,Soviet Union,11,15,"{""proved_victims"": 11, ""possible_victims"": 15, ""female"": 0, ""male"": 0, ""under_18"": 0, ""18_30"": 0, ""31_45"": 0, ""46_60"": 0, ""above_60"": 0, ""major_occupation"": null}","Soviet Union , later Russia",,,,,Murder,,"Vitaly Yegorovich Manishin ( Russian : Вита́лий Его́рович Мани́шин ; born 10 November 1971), known as The Barnaul Maniac ( Russian : Барнаульский маньяк ), is a Soviet–Russian serial killer who raped and murdered at least 11 young girls and women in Barnaul and Buranovo from 1989 to 2000.",,,https://en.wikipedia.org/wiki/Vitaly_Manishin,2026-07-05T16:25:36.094250+00:00
