id,name,known_as,image_url,birth_year,birth_location,murder_count_proved,murder_count_actual,victim_stats,country,years_active_from,years_active_to,active_in_provinces,method,sentence_details,motive,additional_info,status,caught_by,source_url,scraped_at
495,Peter Lundin,"[""Niels Schaftner Bjarne Skounborg Thomas Kristian Olesen""]",,1972,Denmark,4,,"{""proved_victims"": 4, ""possible_victims"": null, ""female"": 0, ""male"": 0, ""under_18"": 0, ""18_30"": 0, ""31_45"": 0, ""46_60"": 0, ""above_60"": 0, ""major_occupation"": null}","United States , Denmark",,,"[""North Carolina"", ""Copenhagen""]",,Murder,,"Peter Kenneth Bostrøm Lundin (born February 15, 1972), who later renamed himself to Bjarne Skounborg and most recently to Thomas Kristian Olesen , is a Danish serial killer who, on March 15, 2001, was sentenced to life imprisonment by the Østre Landsret for a triple murder. The night between June 16 and 17, 2000, he killed and then dismembered his cohabitant Marianne Pedersen and her two sons, Dennis (10) and Brian (12), in their house at Nørregårdsvej 26 in Rødovre .",,,https://en.wikipedia.org/wiki/Peter_Lundin,2026-07-05T16:42:26.188278+00:00
496,James Swann,,,1964,U.S.,4,,"{""proved_victims"": 4, ""possible_victims"": null, ""female"": 0, ""male"": 0, ""under_18"": 0, ""18_30"": 0, ""31_45"": 0, ""46_60"": 0, ""above_60"": 0, ""major_occupation"": null}",United States,,,"[""Washington"", ""D.C.""]",,,Mental illness,"James Edward Swann Jr. a.k.a. The Shotgun Stalker (born 1964), is an African-American serial killer whose random drive-by shotgun shootings in Washington, D.C. in 1993 earned him his nickname in the press. Swann was living in the Iselin section of Woodbridge Township, New Jersey before the attacks. He has been confined to St. Elizabeths Hospital since 1994 as a forensic patient since he was found not guilty by reason of insanity. His request for a furlough in 2011 was denied.",,,https://en.wikipedia.org/wiki/James_Swann,2026-07-05T16:42:29.043827+00:00
497,Steven Grieveson,,,1970,England,4,,"{""proved_victims"": 4, ""possible_victims"": null, ""female"": 0, ""male"": 0, ""under_18"": 0, ""18_30"": 0, ""31_45"": 0, ""46_60"": 0, ""above_60"": 0, ""major_occupation"": null}",England,,,,,Murder,,"Steven John Grieveson (born 14 December 1970) is a British serial killer known as the Sunderland Strangler, who murdered four teenage boys in a series of killings committed between 1990 and 1994 in Sunderland , England. Convicted of three counts of murder at Leeds Crown Court , Grieveson was handed three life sentences on 28 February 1996, with a recommendation that he serve a minimum of 35 years before the Home Secretary considers his eligibility for release.",,,https://en.wikipedia.org/wiki/Steven_Grieveson,2026-07-05T16:42:32.217281+00:00
498,Frank Gust,,,1969,West Germany,4,,"{""proved_victims"": 4, ""possible_victims"": null, ""female"": 0, ""male"": 0, ""under_18"": 0, ""18_30"": 0, ""31_45"": 0, ""46_60"": 0, ""above_60"": 0, ""major_occupation"": null}",Germany,,,,,Murder,,"Frank Gust (born 24 May 1969) is a German serial killer . He has been dubbed The Rhine-Ruhr Ripper by the media because his actions, mainly committed in the Rhine-Ruhr region in western Germany, share similarities with London's Jack the Ripper murders.",,,https://en.wikipedia.org/wiki/Frank_Gust,2026-07-05T16:42:34.682541+00:00
499,Alexander Tchayka,,https://upload.wikimedia.org/wikipedia/en/thumb/1/1f/Alexander_Tchayka.png/250px-Alexander_Tchayka.png,1974,Soviet Union,4,,"{""proved_victims"": 4, ""possible_victims"": null, ""female"": 0, ""male"": 0, ""under_18"": 0, ""18_30"": 0, ""31_45"": 0, ""46_60"": 0, ""above_60"": 0, ""major_occupation"": null}",Russia,,,,,,,"Alexander Nikolaevich Tchayka ( Russian : Александр Николаевич Чайка , born 23 July 1974) is a Ukrainian spree killer , also known as The Fur Coat Hunter , convicted of the killing of 4 women in Moscow over a two-week period in early 1994.",,,https://en.wikipedia.org/wiki/Alexander_Tchayka,2026-07-05T16:42:37.849681+00:00
500,Peter Moore,,https://upload.wikimedia.org/wikipedia/en/d/d2/Peter_Moore_mugshot.jpg,1946,England,4,,"{""proved_victims"": 4, ""possible_victims"": null, ""female"": 0, ""male"": 0, ""under_18"": 0, ""18_30"": 0, ""31_45"": 0, ""46_60"": 0, ""above_60"": 0, ""major_occupation"": null}",United Kingdom,,,,,,,"Peter Howard Moore (born 19 September 1946) is a British serial killer who managed cinemas in Bagillt , Holyhead, Kinmel Bay and Denbigh in North Wales at the time of his arrest. He murdered four men in 1995. Due to his trademark attire of a black shirt and tie, he was dubbed the ""man in black"".",,,https://en.wikipedia.org/wiki/Peter_Moore_(serial_killer),2026-07-05T16:42:41.053723+00:00
501,Hiroaki Hidaka,,https://upload.wikimedia.org/wikipedia/en/1/17/Hidaka_000.jpg,1962,Japan,4,,"{""proved_victims"": 4, ""possible_victims"": null, ""female"": 0, ""male"": 0, ""under_18"": 0, ""18_30"": 0, ""31_45"": 0, ""46_60"": 0, ""above_60"": 0, ""major_occupation"": null}",Japan,,,,,Murder (4 counts),,"Hiroaki Hidaka ( 日高 広明 , Hidaka Hiroaki ; 17 April 1962 – 25 December 2006) was a Japanese serial killer .",,,https://en.wikipedia.org/wiki/Hiroaki_Hidaka,2026-07-05T16:42:44.122151+00:00
502,Nicolai Bonner,,,1972,1972 (age 53 – 54) Moldavian SSR,4,,"{""proved_victims"": 4, ""possible_victims"": null, ""female"": 0, ""male"": 0, ""under_18"": 0, ""18_30"": 0, ""31_45"": 0, ""46_60"": 0, ""above_60"": 0, ""major_occupation"": null}",Israel,,,,,,,"Nicolai Bonner ( Hebrew : ניקולאי בונר ; born 1972), known as The Haifa Homeless Killer ( Hebrew : רוצח ההומלסים ), is a Moldovan -born Israeli serial killer who killed four people in Haifa between February and May 2005. For these crimes, he was sentenced to life imprisonment .",,,https://en.wikipedia.org/wiki/Nicolai_Bonner,2026-07-05T16:42:47.092640+00:00
503,Raúl Osiel Marroquín,"[""The Sadist [ a ] The Rainbow Killer [ b ]""]",https://upload.wikimedia.org/wikipedia/en/thumb/4/4c/Raul_Osiel_Marroquin_mugshot.jpg/250px-Raul_Osiel_Marroquin_mugshot.jpg,1980,Mexico,4,,"{""proved_victims"": 4, ""possible_victims"": null, ""female"": 0, ""male"": 0, ""under_18"": 0, ""18_30"": 0, ""31_45"": 0, ""46_60"": 0, ""above_60"": 0, ""major_occupation"": null}",Mexico,,,,,Incarcerated,,"Raúl Osiel Marroquín Reyes (born 1 September 1980), known as The Sadist and The Rainbow Killer , is a Mexican serial killer who kidnapped and tortured six young men in 2005, killing four of them.",,,https://en.wikipedia.org/wiki/Raúl_Osiel_Marroquín,2026-07-05T16:42:50.406531+00:00
504,Viktor Karamarkov,"[""\""The Macedonian Raskolnikov\"" \""The Skopje serial killer\""""]",https://upload.wikimedia.org/wikipedia/en/7/7f/Viktor_Karamarkov.jpeg,1981,SFR Yugoslavia,4,,"{""proved_victims"": 4, ""possible_victims"": null, ""female"": 0, ""male"": 0, ""under_18"": 0, ""18_30"": 0, ""31_45"": 0, ""46_60"": 0, ""above_60"": 0, ""major_occupation"": null}",North Macedonia,,,,,,,"Viktor Karamarkov (born 1981), known as The Macedonian Raskolnikov , is a Macedonian serial killer who murdered four elderly women in the nation's capital from March to October 2009. Additionally responsible for numerous thefts and three attempted murders, he was sentenced to life imprisonment , and is currently incarcerated in Kolonija Idrizovo .",,,https://en.wikipedia.org/wiki/Viktor_Karamarkov,2026-07-05T16:42:58.272334+00:00
505,Dale Cregan,,https://upload.wikimedia.org/wikipedia/commons/thumb/f/f9/Tributes_to_Nicola_Hughes_%26_Fiona_Bone_-_geograph.org.uk_-_3141738.jpg/250px-Tributes_to_Nicola_Hughes_%26_Fiona_Bone_-_geograph.org.uk_-_3141738.jpg,,,4,,"{""proved_victims"": 4, ""possible_victims"": null, ""female"": 0, ""male"": 0, ""under_18"": 0, ""18_30"": 0, ""31_45"": 0, ""46_60"": 0, ""above_60"": 0, ""major_occupation"": null}",,,,"[""Hattersley"", ""Tameside"", ""Greater Manchester"", ""England""]",,,,"On 18 September 2012, two Greater Manchester Police officers, Nicola Hughes and Fiona Bone, were killed by Dale Cregan in a gun and grenade ambush while responding to a report of a burglary in Tameside , Greater Manchester , England.",,,https://en.wikipedia.org/wiki/Dale_Cregan,2026-07-05T16:43:11.429309+00:00
506,Richard Kuklinski,"[""The Iceman Big Rich [ 1 ] Big Richie""]",https://upload.wikimedia.org/wikipedia/en/thumb/a/ac/Richardkuklinski2.JPG/250px-Richardkuklinski2.JPG,1935,U.S.,3,100,"{""proved_victims"": 3, ""possible_victims"": 100, ""female"": 0, ""male"": 0, ""under_18"": 0, ""18_30"": 0, ""31_45"": 0, ""46_60"": 0, ""above_60"": 0, ""major_occupation"": null}",,,,,,Murder (5 counts),,"Richard Leonard Kuklinski ( / k ʊ ˈ k l ɪ n s k i / : April 11, 1935 – March 5, 2006), also known by his nickname the Iceman , was an American criminal and leader of a New Jersey -based burglary ring. He engaged in criminal activities for most of his adult life, which began when he distributed pirated pornography and eventually escalated to at least five murders committed between 1980 and 1984 for personal profit. His nickname derives from his freezing the body of one of his victims in an attempt to disguise the time of death.",,,https://en.wikipedia.org/wiki/Richard_Kuklinski,2026-07-05T16:43:25.707294+00:00
507,Harvey Miguel Robinson,,https://upload.wikimedia.org/wikipedia/en/2/24/HarveyMRobinson.jpg,1974,U.S.,3,3,"{""proved_victims"": 3, ""possible_victims"": 3, ""female"": 0, ""male"": 0, ""under_18"": 0, ""18_30"": 0, ""31_45"": 0, ""46_60"": 0, ""above_60"": 0, ""major_occupation"": null}",United States,,,"[""Pennsylvania""]",,Incarcerated,,"Harvey Miguel Robinson (born December 6, 1974) is an American serial killer currently imprisoned on death row in Pennsylvania . He was 17 when he committed his violent spree, killing three and injuring two.",,,https://en.wikipedia.org/wiki/Harvey_Miguel_Robinson,2026-07-05T16:43:32.733654+00:00
508,Albert Fish,"[""Frank Howard Thomas A. Sprague Robert Hayden John W. Pell""]",https://upload.wikimedia.org/wikipedia/commons/thumb/f/f9/Albert_Fish_1903_%283x4_cropped%29.jpg/250px-Albert_Fish_1903_%283x4_cropped%29.jpg,,U.S.,3,9,"{""proved_victims"": 3, ""possible_victims"": 9, ""female"": 0, ""male"": 0, ""under_18"": 0, ""18_30"": 0, ""31_45"": 0, ""46_60"": 0, ""above_60"": 0, ""major_occupation"": null}",United States,,,,,Executed by electrocution,Sexual sadism pedophilia cannibalism,"Hamilton Howard "" Albert "" Fish (May 19, 1870 – January 16, 1936) was an American serial killer , rapist , child molester and cannibal who committed at least three child murders between July 1924 and June 1928. He was also known as the Gray Man , the Werewolf of Wysteria , the Brooklyn Vampire , the Moon Maniac and the Boogey Man . Fish was a suspect in at least ten murders during his lifetime, although he only confessed to three that police were able to trace to a known homicide . He also confessed to stabbing at least two other people.",,,https://en.wikipedia.org/wiki/Albert_Fish,2026-07-05T16:43:41.442862+00:00
509,Robert Ben Rhoades,,https://upload.wikimedia.org/wikipedia/en/1/1f/Robert_Ben_Rhoades.jpg,1945,U.S.,3,50,"{""proved_victims"": 3, ""possible_victims"": 50, ""female"": 0, ""male"": 0, ""under_18"": 0, ""18_30"": 0, ""31_45"": 0, ""46_60"": 0, ""above_60"": 0, ""major_occupation"": null}",United States,,,"[""Texas Illinois""]",,,,"Robert Ben Rhoades (born November 22, 1945), also known as the Truck Stop Killer , is an American serial killer and rapist . He is confirmed to have tortured and killed at least two couples in Illinois and Texas in 1989 and 1990, and is additionally suspected of torturing, raping, and killing more than fifty women between 1975 and 1990, based on data about his truck routes and women who went missing during those years and who met the profile of his preferred victims. At the time he was caught, Rhoades claimed to have engaged in these activities for fifteen years.",,,https://en.wikipedia.org/wiki/Robert_Ben_Rhoades,2026-07-05T16:43:48.393635+00:00
510,Peter Tobin,"[""Up to 40 aliases"", ""[ 1 ] including: Peter Wilson James Kelly Paul Semple John Tobin Peter Proban Pat McLaughlin [ 2 ]""]",https://upload.wikimedia.org/wikipedia/en/thumb/0/02/Peter_Tobin_police_mugshot_crop.jpg/250px-Peter_Tobin_police_mugshot_crop.jpg,1946,Scotland,3,48,"{""proved_victims"": 3, ""possible_victims"": 48, ""female"": 0, ""male"": 0, ""under_18"": 0, ""18_30"": 0, ""31_45"": 0, ""46_60"": 0, ""above_60"": 0, ""major_occupation"": null}",,,,,,,,Peter Britton Tobin (27 August 1946 – 8 October 2022) was a Scottish serial killer and sex offender who served a whole life order for three murders committed between 1991 and 2006. Police also investigated Tobin over the deaths and disappearances of other young women and girls.,,,https://en.wikipedia.org/wiki/Peter_Tobin,2026-07-05T16:44:02.038070+00:00
511,Pedro Padilla Flores,"[""The Rio Bravo Assassin Many other aliases""]",,1970,Ramiro Adame López 1970s,3,30,"{""proved_victims"": 3, ""possible_victims"": 30, ""female"": 0, ""male"": 0, ""under_18"": 0, ""18_30"": 0, ""31_45"": 0, ""46_60"": 0, ""above_60"": 0, ""major_occupation"": null}",Mexico,,,,,Murder,,"Pedro Padilla Flores (born in the 1970s), also known as The Rio Bravo Assassin among many other aliases, is a Mexican serial killer who was convicted of killing three women in Ciudad Juárez but is suspected of murdering up to 27 more, some of whom were underage. He was captured and sentenced to prison time for three murders in 1986, but he escaped in 1990 and, after remaining a fugitive from justice, was recaptured in New Mexico and deported back to Ciudad Juárez. On January 24, 2014, ICE agents delivered Padilla to agents from the Mexican Ministerial Police. Currently, he is one of the main suspects in the unsolved femicides in Ciudad Juárez . He was a disorganized, sedentary, hedonistic murderer motivated by sexual compulsion and predatory behaviour.",,,https://en.wikipedia.org/wiki/Pedro_Padilla_Flores,2026-07-05T16:44:15.119063+00:00
512,Stephen Morin,"[""Rich Clark Rich Clarke Robert Fred Generoso Thomas David Hones Ray Constantino (or Constantine)""]",https://upload.wikimedia.org/wikipedia/en/5/56/Stephen_Peter_Morin.jpg,1951,U.S.,3,30,"{""proved_victims"": 3, ""possible_victims"": 30, ""female"": 0, ""male"": 0, ""under_18"": 0, ""18_30"": 0, ""31_45"": 0, ""46_60"": 0, ""above_60"": 0, ""major_occupation"": null}",United States,,,"[""Nevada"", ""Colorado"", ""Texas (others suspected)""]",,Executed by lethal injection,,"Stephen Peter Morin (February 19, 1951 – March 13, 1985) was an American serial killer who was suspected of being responsible for at least forty murders of young girls and women and seven men in the period from 1969 to 1981. Since Morin led a transient lifestyle and constantly moved around the country, the exact number of his victims is uncertain, but he is suspected of committing a total of 48 violent crimes across the United States. In the early 1980s, he was pursued by the federal authorities . Morin had created multiple aliases. These names included Rich Clark, Robert Fred Generoso, Thomas David Hones, and Ray Constantino or Constantine. The court found Morin sane and sentenced him to death by lethal injection . In 1985, he was executed by Texas after waiving his appeals.",,,https://en.wikipedia.org/wiki/Stephen_Morin,2026-07-05T16:44:25.980707+00:00
513,Dorothea Puente,"[""\""Death House Landlady\"" Teya Singoalla Neyaarda Sharon Johansson""]",https://upload.wikimedia.org/wikipedia/commons/thumb/9/91/Dorothy_Puente.jpg/250px-Dorothy_Puente.jpg,1929,U.S.,3,9,"{""proved_victims"": 3, ""possible_victims"": 9, ""female"": 0, ""male"": 0, ""under_18"": 0, ""18_30"": 0, ""31_45"": 0, ""46_60"": 0, ""above_60"": 0, ""major_occupation"": null}",United States,,,,,,,"Dorothea Helen Puente ( née Gray ; January 9, 1929 – March 27, 2011), also known as the Killer Landlady or the Death House Landlady , was an American serial killer and financial fraudster who murdered various tenants of the boarding house she ran in Sacramento, California , between 1982 and 1988.",,,https://en.wikipedia.org/wiki/Dorothea_Puente,2026-07-05T16:44:33.947898+00:00
514,Ángel Díaz Balbín,,https://upload.wikimedia.org/wikipedia/en/thumb/3/32/Angel_Diaz_Balbin.jpg/250px-Angel_Diaz_Balbin.jpg,1955,Peru,3,20,"{""proved_victims"": 3, ""possible_victims"": 20, ""female"": 0, ""male"": 0, ""under_18"": 0, ""18_30"": 0, ""31_45"": 0, ""46_60"": 0, ""above_60"": 0, ""major_occupation"": null}",Peru,,,,,Murder × 3 (1976),,"Ángel Díaz Balbín (17 April 1955 – 9 February 1986), nicknamed the Lima Ripper or the Vampire of Breña , was a Peruvian convicted murderer and suspected serial killer who murdered possibly more than 20 people between 1976 and 1986.",,,https://en.wikipedia.org/wiki/Ángel_Díaz_Balbín,2026-07-05T16:44:38.120786+00:00
515,Billy Glaze,"[""Jesse Coulter Jesse Sitting Crow Butcher Knife Billy""]",,1943,U.S.,3,20,"{""proved_victims"": 3, ""possible_victims"": 20, ""female"": 0, ""male"": 0, ""under_18"": 0, ""18_30"": 0, ""31_45"": 0, ""46_60"": 0, ""above_60"": 0, ""major_occupation"": null}",,,,,,First degree murder (3 counts),,"Billy Richard Glaze (July 13, 1943 – December 22, 2015), also known as ""Jesse Sitting Crow"" was a convicted American serial killer whose guilt has come into question by the discovery of DNA evidence excluding Glaze and implicating another man.",,,https://en.wikipedia.org/wiki/Billy_Glaze,2026-07-05T16:44:42.769708+00:00
516,Sidney Cooke,,,1972,27 September 1972 India,3,20,"{""proved_victims"": 3, ""possible_victims"": 20, ""female"": 0, ""male"": 0, ""under_18"": 0, ""18_30"": 0, ""31_45"": 0, ""46_60"": 0, ""above_60"": 0, ""major_occupation"": null}",,,,"[""Hackney"", ""east London and other parts of England""]",,Incarcerated,Paedophilia,"Sidney Charles Cooke (born 18 April 1927) is an English convicted child molester , murderer and suspected serial killer and serial rapist serving two life sentences . He was the leader of a child sex ring suspected of up to twenty child murders of young boys in the 1970s and 1980s. Cooke and other members of the ring were convicted of three killings in total, although he was only convicted of one himself.",,,https://en.wikipedia.org/wiki/Sidney_Cooke,2026-07-05T16:44:45.572032+00:00
517,Bertha Gifford,,,,U.S.,3,17,"{""proved_victims"": 3, ""possible_victims"": 17, ""female"": 0, ""male"": 0, ""under_18"": 0, ""18_30"": 0, ""31_45"": 0, ""46_60"": 0, ""above_60"": 0, ""major_occupation"": null}",United States,,,,,,,"Bertha Alice Williams Graham Gifford (October 30, 1871 – August 20, 1951) was a farmwife in rural Catawissa, Missouri during the early 1900s who was accused of murdering three members of the local community and suspected in 15 additional deaths. Some consider her to be America's fifth solo female serial killer , behind Belle Gunness , Lydia Sherman , Jane Toppan , and Nannie Doss .",,,https://en.wikipedia.org/wiki/Bertha_Gifford,2026-07-05T16:44:49.409299+00:00
518,Bernhard Prigan,"[""\""The Strangler\"" \""The Highway Killer\""""]",,1920,1920 (age 105 – 106) Germany,3,16,"{""proved_victims"": 3, ""possible_victims"": 16, ""female"": 0, ""male"": 0, ""under_18"": 0, ""18_30"": 0, ""31_45"": 0, ""46_60"": 0, ""above_60"": 0, ""major_occupation"": null}","Allied-occupied Germany , West Germany",,,,,Murder,,Bernhard Prigan (born 1920) is a German serial killer who killed at least three women between the end of the 1940s and the early 1950s.,,,https://en.wikipedia.org/wiki/Bernhard_Prigan,2026-07-05T16:44:52.895721+00:00
519,Ronald Janssen,,,1971,Belgium,3,15,"{""proved_victims"": 3, ""possible_victims"": 15, ""female"": 0, ""male"": 0, ""under_18"": 0, ""18_30"": 0, ""31_45"": 0, ""46_60"": 0, ""above_60"": 0, ""major_occupation"": null}",Belgium,,,,,Murder Kidnapping Rape,,"Ronald Alain Janssen (born February 6, 1971) is a Belgian serial killer who was sentenced to life imprisonment on October 21, 2011, for the murder of three people.",,,https://en.wikipedia.org/wiki/Ronald_Janssen,2026-07-05T16:44:56.161411+00:00
520,Patrick Mackay,"[""David Groves [ 2 ] The Psychopath [ 3 ] The Devil's Disciple [ 4 ]""]",https://upload.wikimedia.org/wikipedia/en/8/87/Patrick_Mackay.jpg,1952,England [ 1 ],3,13,"{""proved_victims"": 3, ""possible_victims"": 13, ""female"": 0, ""male"": 0, ""under_18"": 0, ""18_30"": 0, ""31_45"": 0, ""46_60"": 0, ""above_60"": 0, ""major_occupation"": null}",United Kingdom,,,,,Manslaughter (3 counts) (1975),,"David Groves , better known by his birth name Patrick David Mackay (born 25 September 1952), is believed to be one of the United Kingdom's most prolific serial killers . He was convicted of three counts of manslaughter and two additional cases that were left to lie on file . Detectives stated that Mackay confessed in remand to the murders of six more people across London , Essex and Kent between 1973 and 1975. All of these alleged victims were found to match existing unsolved murders.",,,https://en.wikipedia.org/wiki/Patrick_Mackay,2026-07-05T16:44:59.447163+00:00
521,Bruce Lindahl,,https://upload.wikimedia.org/wikipedia/en/thumb/f/fd/Bruce_Lindahl.png/250px-Bruce_Lindahl.png,1953,U.S.,3,12,"{""proved_victims"": 3, ""possible_victims"": 12, ""female"": 0, ""male"": 0, ""under_18"": 0, ""18_30"": 0, ""31_45"": 0, ""46_60"": 0, ""above_60"": 0, ""major_occupation"": null}",United States,,,,,,,"Bruce Everitt Lindahl (January 29, 1953 – April 4, 1981) was an American serial killer and rapist who committed a series of rapes and murders in the late 1970s and early 1980s. In 2020, Lindahl was connected to the death of 16-year-old Pamela Maurer, who was killed on January 13, 1976, in DuPage County, Illinois . Additionally in 2024, DNA evidence linked him to the murder of Kathy Halle in Illinois in March 1979. He has been declared an official suspect in at least 12 murders and nine rapes committed in different Chicago suburbs from 1974 to 1981.",,,https://en.wikipedia.org/wiki/Bruce_Lindahl_(criminal),2026-07-05T16:45:02.231870+00:00
522,Koos Hertogs,,https://upload.wikimedia.org/wikipedia/commons/0/04/Koos-hertogs.webp,1949,Netherlands,3,12,"{""proved_victims"": 3, ""possible_victims"": 12, ""female"": 0, ""male"": 0, ""under_18"": 0, ""18_30"": 0, ""31_45"": 0, ""46_60"": 0, ""above_60"": 0, ""major_occupation"": null}",Netherlands,,,,,,,"Jacobus Dirk (Koos) Hertogs ( The Hague , 16 December 1949 – 's-Hertogenbosch , 19 July 2015) was a convicted Dutch serial killer . He was convicted of a total of three murders.",,,https://en.wikipedia.org/wiki/Koos_Hertogs,2026-07-05T16:45:05.279579+00:00
523,Michael Gargiulo,"[""Hollywood Ripper Chiller Killer The Boy Next Door Killer""]",https://upload.wikimedia.org/wikipedia/commons/thumb/e/e2/MichaelGargiulo.jpg/250px-MichaelGargiulo.jpg,1976,U.S.,3,10,"{""proved_victims"": 3, ""possible_victims"": 10, ""female"": 0, ""male"": 0, ""under_18"": 0, ""18_30"": 0, ""31_45"": 0, ""46_60"": 0, ""above_60"": 0, ""major_occupation"": null}",United States,,,"[""Illinois California""]",,Death,,"Michael Thomas Gargiulo (born February 15, 1976) is a convicted American serial killer . He moved to Southern California in the 1990s and gained the nickname The Hollywood Ripper . He was convicted of two counts of first-degree murder and sentenced to death on July 16, 2021. As of April 2023 , he was incarcerated in the California Health Care Facility ; in September 2024, he was extradited to Cook County, Illinois , to face trial for the 1993 murder of Tricia Pacaccio.",,,https://en.wikipedia.org/wiki/Michael_Gargiulo,2026-07-05T16:45:08.323372+00:00
524,Chisako Kakehi,,,1946,Allied-occupied Japan,3,10,"{""proved_victims"": 3, ""possible_victims"": 10, ""female"": 0, ""male"": 0, ""under_18"": 0, ""18_30"": 0, ""31_45"": 0, ""46_60"": 0, ""above_60"": 0, ""major_occupation"": null}",Japan,,,,,Deceased,,"Chisako Kakehi ( 筧千佐子 , Kakehi Chisako ; November 28, 1946 – December 26, 2024) was a Japanese serial killer who was sentenced to death for the murders of three men, including her husband, and for the attempted murder of a fourth. She was also suspected in at least seven other deaths.",,,https://en.wikipedia.org/wiki/Chisako_Kakehi,2026-07-05T16:45:10.755228+00:00
525,Heriberto Seda,"[""The Brooklyn Sniper The Copycat Zodiac Killer Faust The New York Zodiac Killer""]",https://upload.wikimedia.org/wikipedia/en/d/d9/HeribetoSedaNYDOCPhoto.jpg,1967,U.S.,3,8,"{""proved_victims"": 3, ""possible_victims"": 8, ""female"": 0, ""male"": 0, ""under_18"": 0, ""18_30"": 0, ""31_45"": 0, ""46_60"": 0, ""above_60"": 0, ""major_occupation"": null}",United States,,,,,,,"Heriberto "" Eddie "" Seda (born July 31, 1967), often referred to as The New York Zodiac or The Brooklyn Sniper , is an American serial killer who was active in New York City from 1990 through 1993. He fatally shot three people and wounded six others (four critically) before being caught on June 18, 1996.",,,https://en.wikipedia.org/wiki/Heriberto_Seda,2026-07-05T16:45:13.285669+00:00
526,Anthony Hardy,,,1951,England,3,8,"{""proved_victims"": 3, ""possible_victims"": 8, ""female"": 0, ""male"": 0, ""under_18"": 0, ""18_30"": 0, ""31_45"": 0, ""46_60"": 0, ""above_60"": 0, ""major_occupation"": null}",United Kingdom,,,,,Murder,,"Anthony John Hardy (31 May 1951 – 25 November 2020) was an English serial killer who was known as the Camden Ripper for beheading and dismembering some of his victims. In November 2003, he was sentenced to three life terms for three murders, but police believe he may have been responsible for up to six more.",,,https://en.wikipedia.org/wiki/Anthony_Hardy,2026-07-05T16:45:16.413424+00:00
