id,name,known_as,image_url,birth_year,birth_location,murder_count_proved,murder_count_actual,victim_stats,country,years_active_from,years_active_to,active_in_provinces,method,sentence_details,motive,additional_info,status,caught_by,source_url,scraped_at
308,Aileen Wuornos,"[""Sandra Kretsch Susan Lynn Blahovec Lee Blahovec Cammie Marsh Greene Lori Kristine Grody [ 1 ]""]",https://upload.wikimedia.org/wikipedia/commons/thumb/2/2a/Aileen_Wuornos_%284x5_cropped%29.jpg/250px-Aileen_Wuornos_%284x5_cropped%29.jpg,1956,U.S.,7,7,"{""proved_victims"": 7, ""possible_victims"": 7, ""female"": 0, ""male"": 0, ""under_18"": 0, ""18_30"": 0, ""31_45"": 0, ""46_60"": 0, ""above_60"": 0, ""major_occupation"": null}",United States,,,,,First-degree murder (6 counts),,"Aileen Carol Wuornos ( / ˈ w ɔːr n oʊ s / ) ( née Pittman ; February 29, 1956 – October 9, 2002) was an American serial killer . Between 1989 and 1990, while engaging in street prostitution along highways in Florida , Wuornos shot, killed, and robbed seven of her male clients. She initially claimed that her victims had either raped or attempted to rape her, and that the homicides were committed in self-defense , but later abandoned this defense. Wuornos was sentenced to death for six of the murders and was executed in 2002 after spending more than ten years on Florida's death row .",,,https://en.wikipedia.org/wiki/Aileen_Wuornos,2026-07-05T16:32:05.080011+00:00
309,Hu Daoping,,https://upload.wikimedia.org/wikipedia/en/thumb/7/72/HuDaoping.png/250px-HuDaoping.png,1971,China,7,7,"{""proved_victims"": 7, ""possible_victims"": 7, ""female"": 0, ""male"": 0, ""under_18"": 0, ""18_30"": 0, ""31_45"": 0, ""46_60"": 0, ""above_60"": 0, ""major_occupation"": null}",China,,,,,Murder,,"Hu Daoping ( Chinese : 胡道平 ; pinyin : Hú Dàopíng ; Wade–Giles : Hu Tao P'ing ; 1971 – April 14, 2006), also known by his alias Wu Jun ( Chinese : 吳軍 ), was a Chinese criminal and serial killer who killed seven people during robberies between 2003 and 2005 after escaping from prison . Hu was later sentenced to death and executed by shooting in 2006.",,,https://en.wikipedia.org/wiki/Hu_Daoping,2026-07-05T16:32:08.001014+00:00
310,Nikos Metaxas,,https://upload.wikimedia.org/wikipedia/commons/thumb/3/3a/Red_lake%2C_Mitsero_mine%2C_Mitsero%2C_Cyprus_02.jpg/330px-Red_lake%2C_Mitsero_mine%2C_Mitsero%2C_Cyprus_02.jpg,,,7,7,"{""proved_victims"": 7, ""possible_victims"": 7, ""female"": 0, ""male"": 0, ""under_18"": 0, ""18_30"": 0, ""31_45"": 0, ""46_60"": 0, ""above_60"": 0, ""major_occupation"": null}",,,,"[""Mitsero"", ""Nicosia District"", ""Cyprus""]",,7 life sentences,,"The Mitsero murders were a series of killings committed by Nikos Metaxas, a military officer in the Cypriot National Guard , between September 2016 and August 2018. Five of his seven victims were female foreigners he had met on the online dating site Badoo . The remaining two victims were young children and were the daughters of two of his adult victims.",,,https://en.wikipedia.org/wiki/Mitsero_murders,2026-07-05T16:32:10.858914+00:00
311,José Misael Roldán Concha,,https://upload.wikimedia.org/wikipedia/en/thumb/c/cd/Jos%C3%A9_Rold%C3%A1n_Concha.jpg/250px-Jos%C3%A9_Rold%C3%A1n_Concha.jpg,1934,Chile,7,7,"{""proved_victims"": 7, ""possible_victims"": 7, ""female"": 0, ""male"": 0, ""under_18"": 0, ""18_30"": 0, ""31_45"": 0, ""46_60"": 0, ""above_60"": 0, ""major_occupation"": null}",,,,,,Died in prison,"Unknown, possibly alcoholism","José Misael Roldán Concha (30 June 1934 – ?), better known as The Jackal of Pupunahue ( Spanish : El Chacal de Pupunahue ), was a Chilean coal miner known for the brutal murder of a woman and five of her seven children while on probation for an earlier murder. Although he was originally sentenced to death , then-president Carlos Ibáñez del Campo granted him presidential clemency , essentially reducing his sentence to life in prison .",,,https://en.wikipedia.org/wiki/The_Jackal_of_Pupunahue,2026-07-05T16:32:13.880716+00:00
312,Sataro Fukiage,,https://upload.wikimedia.org/wikipedia/commons/thumb/e/e0/Fukiage_killer.png/250px-Fukiage_killer.png,,Empire of Japan,7,,"{""proved_victims"": 7, ""possible_victims"": null, ""female"": 0, ""male"": 0, ""under_18"": 0, ""18_30"": 0, ""31_45"": 0, ""46_60"": 0, ""above_60"": 0, ""major_occupation"": null}",Japan,,,"[""Kyoto"", ""Gunma"", ""Nagano"", ""Saitama"", ""Chiba""]",,Murder (7 counts),,"Satarō Fukiage ( 吹上 佐太郎 , Fukiage Satarō ; February 1, 1889 – September 28, 1926) was a Japanese rapist and serial killer . He killed at least seven girls. He murdered his first victim in 1906, and killed six girls between 1923 and 1924. He was tried for three out of six cases, but his exact number of victims is unknown.",,,https://en.wikipedia.org/wiki/Sataro_Fukiage,2026-07-05T16:32:16.715032+00:00
313,Joseph Taborsky,,https://upload.wikimedia.org/wikipedia/commons/thumb/0/04/1957Feb23CulombeTaborskyArrest.jpg/250px-1957Feb23CulombeTaborskyArrest.jpg,,,7,,"{""proved_victims"": 7, ""possible_victims"": null, ""female"": 0, ""male"": 0, ""under_18"": 0, ""18_30"": 0, ""31_45"": 0, ""46_60"": 0, ""above_60"": 0, ""major_occupation"": null}",,,,"[""Connecticut ( West Hartford"", ""New Britain"", ""New Haven"", ""Coventry"", ""North Haven"", ""East Hartford )""]",,,Robbery Witness elimination,"The "" Mad Dog killings "" were a spree of robberies and murders committed by serial killer Joseph Louis Taborsky and his partner-in-crime, Arthur Culombe, throughout Connecticut in 1950 and between 1956 and 1957. Authorities and newspapers dubbed the killings the ""Mad Dog killings"" due to the brutality of the murders committed; Taborsky himself was also often given the moniker ""Mad Dog."" Taborsky and Culombe robbed and murdered six people during the 1956–1957 spree. Taborsky and Culombe also robbed, shot, and beat a number of other victims who survived the ""Mad Dog"" crime spree. The murders led to Connecticut liquor stores implementing modified hours of operation, as Taborsky and Culombe frequently targeted liquor stores.",,,"https://en.wikipedia.org/wiki/Joseph_""Mad_Dog""_Taborsky",2026-07-05T16:32:20.651363+00:00
314,Václav Mrázek,,https://upload.wikimedia.org/wikipedia/commons/thumb/a/aa/V%C3%A1clav_Mr%C3%A1zek_signature.jpg/250px-V%C3%A1clav_Mr%C3%A1zek_signature.jpg,1925,Czechoslovakia,7,,"{""proved_victims"": 7, ""possible_victims"": null, ""female"": 0, ""male"": 0, ""under_18"": 0, ""18_30"": 0, ""31_45"": 0, ""46_60"": 0, ""above_60"": 0, ""major_occupation"": null}",Czechoslovakia,,,,,Murder x7,,"Václav Mrázek (22 October 1925 – 29 December 1957) was a Czech serial killer who was convicted of killing at least seven people in Chomutov from 1951 to 1957. While primarily sexually motivated, he also robbed his victims, and at trial, he was convicted of 127 total crimes. For the murders, Mrázek was hanged at the Pankrác Prison in 1957.",,,https://en.wikipedia.org/wiki/Václav_Mrázek,2026-07-05T16:32:24.734551+00:00
315,Anatoly Slivko,,https://upload.wikimedia.org/wikipedia/en/1/12/Anatoly_Slivko.jpg,1938,USSR,7,,"{""proved_victims"": 7, ""possible_victims"": null, ""female"": 0, ""male"": 0, ""under_18"": 0, ""18_30"": 0, ""31_45"": 0, ""46_60"": 0, ""above_60"": 0, ""major_occupation"": null}",Soviet Union,,,,,Murder with aggravating circumstances,Sexual sadism Possession Necrophilia,"Anatoly Yemelianovich Slivko ( Russian : Анатолий Емельянович Сливко; 28 December 1938 – 16 September 1989) was a Soviet serial killer and necrophile who sexually assaulted , murdered, and mutilated seven boys in and around Nevinnomyssk , Stavropol Krai , Russian SFSR , between 1964 and 1985. He is also known to have sexually assaulted at least 36 other victims.",,,https://en.wikipedia.org/wiki/Anatoly_Slivko,2026-07-05T16:32:28.001548+00:00
316,Cincinnati Strangler,,https://upload.wikimedia.org/wikipedia/en/6/6f/Cincinnati_Strangler.jpg,1937,U.S.,7,,"{""proved_victims"": 7, ""possible_victims"": null, ""female"": 0, ""male"": 0, ""under_18"": 0, ""18_30"": 0, ""31_45"": 0, ""46_60"": 0, ""above_60"": 0, ""major_occupation"": null}",United States,,,,,First degree murder,,"The Cincinnati Strangler was the name given to an American serial killer responsible for the murder of seven women in Cincinnati , Ohio , between December 1965 and December 9, 1966. During the investigation, a local resident, Posteal Laskey Jr. (June 18, 1937 – May 29, 2007 ), was declared the main suspect in the killings and was arrested on December 9, 1966, for one of the murders for which he was subsequently convicted. Although he was never charged with the other murders, the media and police blamed him for the other deaths since according to the official version of the investigators, the murders ceased after his arrest.",,,https://en.wikipedia.org/wiki/Cincinnati_Strangler,2026-07-05T16:32:31.231231+00:00
317,Émile Louis,,,,,7,,"{""proved_victims"": 7, ""possible_victims"": null, ""female"": 0, ""male"": 0, ""under_18"": 0, ""18_30"": 0, ""31_45"": 0, ""46_60"": 0, ""above_60"": 0, ""major_occupation"": null}",,,,,,,,"Émile Louis (21 January 1934 – 20 October 2013) was a French bus driver and the prime suspect in the disappearance of seven young women in the Yonne department , Burgundy , in the late 1970s. He confessed to their murders in 2000, but retracted this confession one month later. Louis was sentenced to life in prison by the cour d'assises of Yonne in 2004. The sentence, which was upheld on appeal in 2006, was confirmed by the Court of Cassation in 2007.",,,https://en.wikipedia.org/wiki/Émile_Louis,2026-07-05T16:32:34.524341+00:00
318,Paul Steven Haigh,,,1957,( 1957-09-05 ) 5 September 1957 (age 68),7,,"{""proved_victims"": 7, ""possible_victims"": null, ""female"": 0, ""male"": 0, ""under_18"": 0, ""18_30"": 0, ""31_45"": 0, ""46_60"": 0, ""above_60"": 0, ""major_occupation"": null}",Australia,,,,,Murder (7 counts),,Paul Steven Haigh (born 5 September 1957) is an Australian convicted serial killer currently serving six sentences of life imprisonment without the possibility of parole for the murder of six people in the late 1970s. He also murdered a fellow inmate in 1991.,,,https://en.wikipedia.org/wiki/Paul_Steven_Haigh,2026-07-05T16:32:37.490918+00:00
319,Aleksey Sukletin,"[""\""The Alligator\"""", ""[ 3 ] \""The Vassilyevo Cannibal\"""", ""[ 4 ] \""The Kazan Ogre\"""", ""[ 5 ] \""The Volga Alligator\"" [ 6 ]""]",https://upload.wikimedia.org/wikipedia/en/thumb/7/78/AlekseySukletin.jpg/250px-AlekseySukletin.jpg,1943,Soviet Union,7,,"{""proved_victims"": 7, ""possible_victims"": null, ""female"": 0, ""male"": 0, ""under_18"": 0, ""18_30"": 0, ""31_45"": 0, ""46_60"": 0, ""above_60"": 0, ""major_occupation"": null}",Soviet Union,,,,,Executed,,"Aleksey Vasilyevich Sukletin ( Russian : Алексе́й Васи́льевич Сукле́тин ; 23 March 1943 – 29 July 1987) was a Soviet serial killer , rapist and cannibal. Between 1979 and 1985 (according to other data, from 1981 to 1985), along with accomplices Madina Shakirova and Anatoly Nikitin, he killed and cannibalized seven girls and women in Tatarstan .",,,https://en.wikipedia.org/wiki/Aleksey_Sukletin,2026-07-05T16:32:40.629818+00:00
320,Roberto Succo,"[""\""The Monster of Mestre\"" \""The Killer with the Eyes of Ice\"" \""The Full Moon Assassin\"" \""The Cherubino Nero\"" Roberto Kurt""]",https://upload.wikimedia.org/wikipedia/commons/thumb/3/37/Roberto_Succo.jpg/250px-Roberto_Succo.jpg,1962,Italy,7,,"{""proved_victims"": 7, ""possible_victims"": null, ""female"": 0, ""male"": 0, ""under_18"": 0, ""18_30"": 0, ""31_45"": 0, ""46_60"": 0, ""above_60"": 0, ""major_occupation"": null}","Italy, France",,,,,Murder,,Roberto Succo (3 April 1962 – 23 May 1988) was an Italian serial killer who committed several murders and other violent crimes mostly in Italy and France in the 1980s.,,,https://en.wikipedia.org/wiki/Roberto_Succo,2026-07-05T16:32:44.009807+00:00
321,Walter E. Ellis,"[""\""The Milwaukee North Side Strangler\"" \""Wodell\""""]",https://upload.wikimedia.org/wikipedia/en/thumb/3/31/Walter_E._Ellis.jpg/250px-Walter_E._Ellis.jpg,1960,U.S.,7,,"{""proved_victims"": 7, ""possible_victims"": null, ""female"": 0, ""male"": 0, ""under_18"": 0, ""18_30"": 0, ""31_45"": 0, ""46_60"": 0, ""above_60"": 0, ""major_occupation"": null}",United States,,,,,First degree intentional homicide (7 counts),,"Walter Earl Ellis (June 24, 1960 – December 1, 2013), known as the Milwaukee North Side Strangler , was an American serial killer , rapist , and robber who raped and strangled at least seven women in the city of Milwaukee, Wisconsin between 1986 and 2009. Until May 2009, the killings were considered to be independent of one another, but were then linked together via DNA profiling . Ellis was arrested as a suspect on September 7, 2009, and convicted for the seven murders in February 2011, receiving seven consecutive life sentences without the chance of parole .",,,https://en.wikipedia.org/wiki/Walter_E._Ellis,2026-07-05T16:32:47.281756+00:00
322,Harrison Graham,,https://upload.wikimedia.org/wikipedia/en/thumb/c/c6/Harrison_Graham_serial_killer.png/250px-Harrison_Graham_serial_killer.png,1959,U.S.,7,,"{""proved_victims"": 7, ""possible_victims"": null, ""female"": 0, ""male"": 0, ""under_18"": 0, ""18_30"": 0, ""31_45"": 0, ""46_60"": 0, ""above_60"": 0, ""major_occupation"": null}",United States,,,,,,,"Harrison Frank "" Marty "" Graham (born September 9, 1959) is an American serial killer who murdered seven women in Philadelphia, Pennsylvania between mid-1986 to mid-1987, keeping their remains in his apartment. In 1988, he was found guilty on all charges and sentenced to death , but his sentences were later commuted to life imprisonment. Graham lived less than a mile and a half away from the home of another murderer, Gary M. Heidnik , who was also arrested during the same time period for similar crimes.",,,https://en.wikipedia.org/wiki/Harrison_Graham,2026-07-05T16:32:50.167020+00:00
323,Guy Georges,,https://upload.wikimedia.org/wikipedia/commons/thumb/c/c6/Guy_Georges.jpg/250px-Guy_Georges.jpg,1962,France,7,,"{""proved_victims"": 7, ""possible_victims"": null, ""female"": 0, ""male"": 0, ""under_18"": 0, ""18_30"": 0, ""31_45"": 0, ""46_60"": 0, ""above_60"": 0, ""major_occupation"": null}",France,,,,,Incarcerated,,"Guy Georges (born Guy Rampillon , 15 October 1962) is a French serial killer and serial rapist , dubbed le tueur de l'Est Parisien (""the East Paris killer"") or the Beast of the Bastille ( la bête de la Bastille ). He was convicted on 5 April 2001, of murdering seven women between 1991 and 1997. He was sentenced to life in prison without the possibility of parole for 22 years.",,,https://en.wikipedia.org/wiki/Guy_Georges,2026-07-05T16:32:52.798187+00:00
324,Motta Navas,,,1966,India,7,,"{""proved_victims"": 7, ""possible_victims"": null, ""female"": 0, ""male"": 0, ""under_18"": 0, ""18_30"": 0, ""31_45"": 0, ""46_60"": 0, ""above_60"": 0, ""major_occupation"": null}",India,,,,,Murder,,"Motta Navas (born 1966) is an Indian serial killer who operated in the city of Kollam , Kerala between June and August 2012. Pavement dwellers were bludgeoned to death while they slept. All the murders took place at night and were committed by using stones or hard, blunt objects.",,,https://en.wikipedia.org/wiki/Motta_Navas,2026-07-05T16:32:55.851804+00:00
325,Paul Dennis Reid,"[""\""The Fast Food Killer\"" Justin Parks""]",https://upload.wikimedia.org/wikipedia/en/4/4b/Paul_Dennis_Reid.jpg,1957,U.S.,7,,"{""proved_victims"": 7, ""possible_victims"": null, ""female"": 0, ""male"": 0, ""under_18"": 0, ""18_30"": 0, ""31_45"": 0, ""46_60"": 0, ""above_60"": 0, ""major_occupation"": null}",United States,,,,,First degree murder (7 counts),,"Paul Dennis Reid Jr. (November 12, 1957 – November 1, 2013 ), known as The Fast Food Killer , was an American serial killer , convicted and sentenced to death for seven murders during three fast-food restaurant robberies in Metropolitan Nashville, Tennessee and Clarksville, Tennessee between the months of February and April 1997.",,,https://en.wikipedia.org/wiki/Paul_Dennis_Reid,2026-07-05T16:32:58.527080+00:00
326,Samuel Sidyno,,,1962,Samuel Sidyno 1962 (age 63 – 64) South Africa,7,,"{""proved_victims"": 7, ""possible_victims"": null, ""female"": 0, ""male"": 0, ""under_18"": 0, ""18_30"": 0, ""31_45"": 0, ""46_60"": 0, ""above_60"": 0, ""major_occupation"": null}",South Africa,,,,,,,Samuel Sidyno (born 1962) is a South African serial killer who was convicted in 2000 of seven murders and sentenced to seven life sentences in prison. His victims all came from the Pretoria area of Gauteng .,,,https://en.wikipedia.org/wiki/Samuel_Sidyno,2026-07-05T16:33:01.420784+00:00
327,Ripper Jayanandan,,,1968,India,7,,"{""proved_victims"": 7, ""possible_victims"": null, ""female"": 0, ""male"": 0, ""under_18"": 0, ""18_30"": 0, ""31_45"": 0, ""46_60"": 0, ""above_60"": 0, ""major_occupation"": null}",India,,,"[""Kerala Karnataka""]",,Murder,,"K. P. Jayanandan , infamously known as Ripper Jayanandan (born 1968), is an alleged serial killer from Thrissur , who is accused of seven murders committed during a span of 35 robberies, in and around Thrissur Ernakulam border areas. For the seven murders committed by Jayanandan, including the double murder at Perinjanam in October 2004, Thrissur Principal Sessions judge sentenced him to death by hanging in June 2008 which was later overturned by the Supreme Court. He was sent to Poojapura Central Jail to await execution but escaped in June 2013. He was captured on 9 September 2013 near Thrissur.",,,https://en.wikipedia.org/wiki/Ripper_Jayanandan,2026-07-05T16:33:03.907019+00:00
328,Sibusiso Duma,,,1984,Sibusiso Derrick Duma ( 1984-05-06 ) 6 May 1984 (age 42) South Africa,7,,"{""proved_victims"": 7, ""possible_victims"": null, ""female"": 0, ""male"": 0, ""under_18"": 0, ""18_30"": 0, ""31_45"": 0, ""46_60"": 0, ""above_60"": 0, ""major_occupation"": null}",South Africa,,,,,,,"Sibusiso Derrick Duma (born 6 May 1984) is a South African serial killer who was convicted of two murders in 2007 and five murders in 2009 and sentenced to 8 life sentences in prison. He was mostly active around the City of Pietermaritzburg , KwaZulu Natal .",,,https://en.wikipedia.org/wiki/Sibusiso_Duma,2026-07-05T16:33:07.279588+00:00
329,Tommy Lynn Sells,,https://upload.wikimedia.org/wikipedia/en/a/a2/Tommy_Lynn_Sells.jpg,1964,U.S.,6,22,"{""proved_victims"": 6, ""possible_victims"": 22, ""female"": 0, ""male"": 0, ""under_18"": 0, ""18_30"": 0, ""31_45"": 0, ""46_60"": 0, ""above_60"": 0, ""major_occupation"": null}",United States,,,"[""Missouri"", ""New York"", ""Illinois"", ""Texas"", ""Kentucky"", ""[ 2 ] possibly others""]",,Executed by lethal injection,,"Tommy Lynn Sells (June 28, 1964 – April 3, 2014) was an American serial killer who became known as the Coast to Coast Killer . Although he was convicted of only two murders, one of which led to his being sentenced to death and eventual execution, Sells claimed to have killed up to 70 victims in various states. Investigators have been able to conclusively implicate Sells in at least 22 cases.",,,https://en.wikipedia.org/wiki/Tommy_Lynn_Sells,2026-07-05T16:33:09.989683+00:00
330,Volker Eckert,,,1959,East Germany,6,19,"{""proved_victims"": 6, ""possible_victims"": 19, ""female"": 0, ""male"": 0, ""under_18"": 0, ""18_30"": 0, ""31_45"": 0, ""46_60"": 0, ""above_60"": 0, ""major_occupation"": null}","Czech Republic , France , Germany , Italy , Spain",,,,,Attempted murder,,"Volker Eckert (1 July 1959 – 2 July 2007) was a German serial killer , who killed at least six women in East Germany , France and Spain , between 1974 and 2006. Eckert confessed to only six murders , five of whom were sex workers , but is believed to have killed at least nine women, and is also accused of committing additional murders of women in several European countries including Italy and the Czech Republic , but investigations were closed after Eckert committed suicide during his criminal proceedings on 2 July 2007.",,,https://en.wikipedia.org/wiki/Volker_Eckert,2026-07-05T16:33:12.614416+00:00
331,Lorenzo Gilyard,,https://upload.wikimedia.org/wikipedia/en/f/fb/Lorenzo_Gilyard_serial_killer.png,1950,U.S.,6,13,"{""proved_victims"": 6, ""possible_victims"": 13, ""female"": 0, ""male"": 0, ""under_18"": 0, ""18_30"": 0, ""31_45"": 0, ""46_60"": 0, ""above_60"": 0, ""major_occupation"": null}",United States,,,,,First degree murder (6 counts),,"Lorenzo Jerome Gilyard Jr. (born May 24, 1950), known as The Kansas City Strangler , is an American serial killer . A former trash-company supervisor, Gilyard is believed to have raped and murdered at least 13 women and girls from 1977 to 1993. He was convicted of six counts of first-degree murder on March 16, 2007.",,,https://en.wikipedia.org/wiki/Lorenzo_Gilyard,2026-07-05T16:33:16.242100+00:00
332,Władysław Mazurkiewicz,,https://upload.wikimedia.org/wikipedia/en/6/62/W%C5%82adys%C5%82aw_Mazurkiewicz_%281911-1957%29.jpg,1911,Poland,6,30,"{""proved_victims"": 6, ""possible_victims"": 30, ""female"": 0, ""male"": 0, ""under_18"": 0, ""18_30"": 0, ""31_45"": 0, ""46_60"": 0, ""above_60"": 0, ""major_occupation"": null}",,,,,,Murder (6 counts),,"Władysław Mazurkiewicz (31 January 1911 – 29 January 1957) was a Polish serial killer from the post–World War II Kraków . He also owned property in Warsaw . His economic standing and polite manners in Stalinist Poland earned him the nickname "" The Gentleman Murderer"" ( elegancki morderca ), as well as "" Piękny Władek "" (the handsome Władek).",,,https://en.wikipedia.org/wiki/Władysław_Mazurkiewicz_(serial_killer),2026-07-05T16:33:19.580652+00:00
333,Steve Wright,,https://upload.wikimedia.org/wikipedia/en/thumb/9/99/Wright2006.jpg/250px-Wright2006.jpg,1958,England,6,22,"{""proved_victims"": 6, ""possible_victims"": 22, ""female"": 0, ""male"": 0, ""under_18"": 0, ""18_30"": 0, ""31_45"": 0, ""46_60"": 0, ""above_60"": 0, ""major_occupation"": null}",England,,,,,,,"Steven Gerald James Wright (born 24 April 1958) is an English serial killer , also known as the Suffolk Strangler . He is currently serving life imprisonment for the murder of five women who worked in Ipswich , Suffolk , in 2006. Wright was found guilty in February 2008 and given a whole life order . In February 2026, Wright pleaded guilty to the murder of a sixth victim, 17-year-old Victoria Hall in 1999.",,,https://en.wikipedia.org/wiki/Steve_Wright_(serial_killer),2026-07-05T16:33:22.873389+00:00
334,Gong Runbo,,https://upload.wikimedia.org/wikipedia/en/4/4d/Gong_Runbo.png,1973,6 July 1973 China,6,20,"{""proved_victims"": 6, ""possible_victims"": 20, ""female"": 0, ""male"": 0, ""under_18"": 0, ""18_30"": 0, ""31_45"": 0, ""46_60"": 0, ""above_60"": 0, ""major_occupation"": null}",China,,,,,Murder,,"Gong Runbo ( simplified Chinese : 宫润伯 ; traditional Chinese : 宮潤伯 ; pinyin : Gōng Rùnbó ; 6 July 1973 – 31 December 2006) was a Chinese serial killer who, between March 2005 and February 2006, murdered at least six children between the ages of 9 and 16. Forensic evidence led police to believe he may have possibly killed 28 or more.",,,https://en.wikipedia.org/wiki/Gong_Runbo,2026-07-05T16:33:25.836780+00:00
335,The Doodler,,https://upload.wikimedia.org/wikipedia/commons/thumb/7/7f/The_Doodler.jpg/250px-The_Doodler.jpg,,Unknown,6,16,"{""proved_victims"": 6, ""possible_victims"": 16, ""female"": 0, ""male"": 0, ""under_18"": 0, ""18_30"": 0, ""31_45"": 0, ""46_60"": 0, ""above_60"": 0, ""major_occupation"": null}",United States,,,,,,,"The Doodler is an unidentified serial killer believed responsible for between 6 and 16 murders and three assaults of men in San Francisco, California , United States, between January 1974 and September 1975. The nickname was given due to the perpetrator's habit of sketching his victims prior to stabbing them to death. The perpetrator met his victims at gay nightclubs, bars and restaurants.",,,https://en.wikipedia.org/wiki/Doodler,2026-07-05T16:33:28.841971+00:00
336,Cristopher Chávez Cuellar,,,1973,Colombia,6,15,"{""proved_victims"": 6, ""possible_victims"": 15, ""female"": 0, ""male"": 0, ""under_18"": 0, ""18_30"": 0, ""31_45"": 0, ""46_60"": 0, ""above_60"": 0, ""major_occupation"": null}",Colombia,,,"[""Huila"", ""Tolima"", ""Caquet\u00e1""]",,Murder,,"Cristopher Chávez Cuellar (born 1973), known as The Soulless , is a Colombian serial killer responsible for killing a taxi driver, a woman in Ibagué and 4 minors in 2015. The police believe that he has killed at least 15 people in total.",,,https://en.wikipedia.org/wiki/Cristopher_Chávez_Cuellar,2026-07-05T16:33:32.064697+00:00
337,András Pándy,,,1927,Ukraine),6,14,"{""proved_victims"": 6, ""possible_victims"": 14, ""female"": 0, ""male"": 0, ""under_18"": 0, ""18_30"": 0, ""31_45"": 0, ""46_60"": 0, ""above_60"": 0, ""major_occupation"": null}",Belgium,,,,,,,"András Pándy (1 June 1927 – 23 December 2013) was a Hungarian - Belgian pastor and a serial killer , convicted for the murder of six family members in Brussels between 1986 and 1990.",,,https://en.wikipedia.org/wiki/András_Pándy,2026-07-05T16:33:35.003239+00:00
