id,name,known_as,image_url,birth_year,birth_location,murder_count_proved,murder_count_actual,victim_stats,country,years_active_from,years_active_to,active_in_provinces,method,sentence_details,motive,additional_info,status,caught_by,source_url,scraped_at
1,Luis Garavito,"[""The Beast Goofy Conflict Bonifacio Morera Lizcano""]",https://upload.wikimedia.org/wikipedia/commons/thumb/7/7b/Luis_Alfredo_Garavito_Cubillos.jpg/250px-Luis_Alfredo_Garavito_Cubillos.jpg,1957,Colombia,193,194,"{""proved_victims"": 193, ""possible_victims"": 194, ""female"": 0, ""male"": 0, ""under_18"": 0, ""18_30"": 0, ""31_45"": 0, ""46_60"": 0, ""above_60"": 0, ""major_occupation"": null}",Colombia Ecuador Venezuela,,,"[""Valle del Cauca"", ""Boyac\u00e1"", ""Meta"", ""Quind\u00edo"", ""Risaralda"", ""Cundinamarca"", ""Nari\u00f1o"", ""Huila"", ""Caquet\u00e1"", ""Antioquia and Caldas"", ""[ 5 ] [ page needed ] Chone""]",,"1,853 years and 9 days' imprisonment (2001) [ 2 ] 835 years' imprisonment (2000) [ 3 ] 22 years' imprisonment in Ecuador (2007) [ 4 ]",,"Luis Alfredo Garavito Cubillos (25 January 1957 – 12 October 2023), also known as La Bestia (""The Beast"") or Tribilín ("" Goofy ""), was a Colombian serial killer and sex offender who sexually assaulted 200 victims before murdering 193 victims, mostly young men and boys from 1992 to 1999 in western Colombia.",,,https://en.wikipedia.org/wiki/Luis_Garavito,2026-07-05T16:17:37.118379+00:00
2,Mariam Soulakiotis,,https://upload.wikimedia.org/wikipedia/en/thumb/9/93/Mariam_Soulakiotis_infobox.png/250px-Mariam_Soulakiotis_infobox.png,,Greece,177,500,"{""proved_victims"": 177, ""possible_victims"": 500, ""female"": 0, ""male"": 0, ""under_18"": 0, ""18_30"": 0, ""31_45"": 0, ""46_60"": 0, ""above_60"": 0, ""major_occupation"": null}",,,,,,,,"Abbess Mariam Soulakiotis ( c. 1883 – 23 November 1954), née Marina Soulakiotou , also known either to her followers as Mariam of Keratea , or in contemporary media pejoratively as "" Mother Rasputin "", was a Greek Old Calendarist Orthodox abbess and serial killer who was found guilty of numerous counts of murder , fraud and other crimes , which public prosecutors of the Kingdom of Greece alleged she committed against both laypeople and other nuns in her abbey between 1939 and her arrest in December 1950.",,,https://en.wikipedia.org/wiki/Mariam_Soulakiotis,2026-07-05T16:17:40.043397+00:00
3,Pedro López,"[""El Monstruo de los Andes (The Monster of the Andes) [ 1 ] [ 2 ] [ 3 ] El Estrangulador de los Andes (The Strangler of the Andes) [ 4 ] [ 5 ] Pedro Alonso L\u00f3pez Monsalve [ 6 ] [ 7 ] [ 8 ] Pedro Armando L\u00f3pez [ 9 ] [ 10 ] [ 11 ]""]",https://upload.wikimedia.org/wikipedia/en/thumb/e/ed/Predo_Lopez.png/250px-Predo_Lopez.png,1948,Colombia,110,300,"{""proved_victims"": 110, ""possible_victims"": 300, ""female"": 0, ""male"": 0, ""under_18"": 0, ""18_30"": 0, ""31_45"": 0, ""46_60"": 0, ""above_60"": 0, ""major_occupation"": null}","Colombia , Ecuador , Peru",,,"[""Tolima (Colombia) Tungurahua (Ecuador) Ayacucho (Peru)""]",,Released in 1998,,"Pedro Alonso López (born October 8th 1948 – disappeared 22 September 1999), also known as the Monster of the Andes , is a Colombian serial killer , child rapist , and fugitive who murdered a minimum of 110 people, mostly pre-teen girls, from 1978 to 1980. López claimed to have murdered over 300 people in Colombia, Ecuador, and Peru. He is considered by many as one of the most prolific serial killers and rapists in history.",,,https://en.wikipedia.org/wiki/Pedro_López_(serial_killer),2026-07-05T16:17:42.146382+00:00
4,Javed Iqbal,,https://upload.wikimedia.org/wikipedia/en/3/39/Javed_Iqbal.jpg,1961,Pakistan,100,100,"{""proved_victims"": 100, ""possible_victims"": 100, ""female"": 0, ""male"": 0, ""under_18"": 0, ""18_30"": 0, ""31_45"": 0, ""46_60"": 0, ""above_60"": 0, ""major_occupation"": null}",Pakistan,,,,,,,"Javed Iqbal Mughal (1961 – 8 October 2001) was a Pakistani serial killer and child molester who confessed to the sexual abuse and murder of 100 young boys, ranging in age from 6 to 16. His victims were strangled, dismembered, and then dissolved in acid to destroy any evidence.",,,https://en.wikipedia.org/wiki/Javed_Iqbal_(serial_killer),2026-07-05T16:17:44.235689+00:00
5,Mikhail Popkov,"[""The Werewolf The Angarsk Maniac The Wednesday Murderer""]",https://upload.wikimedia.org/wikipedia/en/thumb/5/57/Mikhail_Popkov.jpeg/250px-Mikhail_Popkov.jpeg,1964,USSR [ 1 ],83,86,"{""proved_victims"": 83, ""possible_victims"": 86, ""female"": 0, ""male"": 0, ""under_18"": 0, ""18_30"": 0, ""31_45"": 0, ""46_60"": 0, ""above_60"": 0, ""major_occupation"": null}",Russia,,,"[""Irkutsk Oblast Primorsky Krai""]",,,Hatred of prostitutes Misogyny Sexual sadism,"Mikhail Viktorovich Popkov ( Russian : Михаи́л Ви́кторович Попко́в ; born 7 March 1964) is a Russian serial killer , rapist , and necrophile who committed the sexual assault and murder of eighty-seven girls and women between 1992 and 2011 in Angarsk , Irkutsk , in Siberia , and Vladivostok in the Russian Far East , although he has confessed to and is suspected of at least ninety in total. He is known as "" the Werewolf "" and "" the Angarsk Maniac "" for the particularly brutal nature of his crimes; he would extensively mutilate the bodies of his victims and perform sexual acts on them. Popkov was also known as "" the Wednesday Murderer "" because most of his victims' bodies were found on Wednesdays. He is the single most prolific serial killer in Russian history.",,,https://en.wikipedia.org/wiki/Mikhail_Popkov,2026-07-05T16:17:46.817008+00:00
6,Daniel Camargo Barbosa,"[""\""The Sadist of El Charquito\"" \""The Monster of the Mangroves\"" Manuel Bulgarin Solis""]",https://upload.wikimedia.org/wikipedia/commons/thumb/e/ef/Daniel_Camargo_Barbosa_1958_Mugshot.png/250px-Daniel_Camargo_Barbosa_1958_Mugshot.png,1930,Colombia,72,180,"{""proved_victims"": 72, ""possible_victims"": 180, ""female"": 0, ""male"": 0, ""under_18"": 0, ""18_30"": 0, ""31_45"": 0, ""46_60"": 0, ""above_60"": 0, ""major_occupation"": null}","Colombia, Ecuador",,,"[""Guayas"", ""Pichincha"", ""Tungurahua"", ""El Oro"", ""Los R\u00edos""]",,,,Daniel Camargo Barbosa (22 January 1930 – 13 November 1994) was a Colombian serial killer and rapist. He is one of the most prolific serial killers in history and is believed to have raped and murdered at least 72 young girls in Colombia and Ecuador during the 1970s and 1980s.,,,https://en.wikipedia.org/wiki/Daniel_Camargo_Barbosa,2026-07-05T16:17:48.750727+00:00
7,Pedro Rodrigues Filho,"[""Killer Petey Pedrinho Matador""]",https://upload.wikimedia.org/wikipedia/commons/d/d2/Pedrinho_Matador%2C_1991%2C_2.jpg,1954,Brazil,71,100,"{""proved_victims"": 71, ""possible_victims"": 100, ""female"": 0, ""male"": 0, ""under_18"": 0, ""18_30"": 0, ""31_45"": 0, ""46_60"": 0, ""above_60"": 0, ""major_occupation"": null}",,20,20,,,,,"Pedro Rodrigues Filho (29 October 1954 – 5 March 2023), also known as Pedrinho Matador , Killer Lil' Pedro , Killer Killer Petey , or simply Killer Petey , was a Brazilian serial killer , spree killer , vigilante , and YouTuber known for pursuing and killing other criminals and suspected criminals. He committed most of his crimes as a teenager, when he was between 14 and 19 years old, and was officially sentenced for 71 murders, but claimed to have killed over 100 people, including drug dealers, rapists, and murderers, and served a total of 34 years in prison before his release in 2007. In 2011, Rodrigues was imprisoned again on charges of inciting riot and deprivation of liberty for crimes committed in prison; he was sentenced to eight years in prison, but was released again in 2018 after seven years on good behavior.",,,https://en.wikipedia.org/wiki/Pedro_Rodrigues_Filho,2026-07-05T16:17:50.839918+00:00
8,Kampatimar Shankariya,,https://upload.wikimedia.org/wikipedia/en/7/7a/Kampatimar_Shankariya.webp,1952,India,70,70,"{""proved_victims"": 70, ""possible_victims"": 70, ""female"": 0, ""male"": 0, ""under_18"": 0, ""18_30"": 0, ""31_45"": 0, ""46_60"": 0, ""above_60"": 0, ""major_occupation"": null}",India,,,,,Murder,,Kampatimar Shankariya (1952 – 16 May 1979) was an Indian serial killer .,,,https://en.wikipedia.org/wiki/Kampatimar_Shankariya,2026-07-05T16:17:52.762449+00:00
9,Hoshang Amini,"[""\""The Ghost of the Qanat Wells\"" \""The Felt Hat Killer\""""]",,1936,Iran,67,67,"{""proved_victims"": 67, ""possible_victims"": 67, ""female"": 0, ""male"": 0, ""under_18"": 0, ""18_30"": 0, ""31_45"": 0, ""46_60"": 0, ""above_60"": 0, ""major_occupation"": null}",Iran,,,,,Murder x67,,"Hoshang Amini ( Persian : هوشنگ امینی ;‎ 1936 – December 1963), known as The Ghost of the Qanat Wells ( شبح چاه‌های قنات ), was an Iranian serial killer and rapist who murdered 67 people in the city of Varamin from 1954 to 1962, sometimes aided by accomplices. He earned his nickname for decapitating his victims post-mortem and then dumping their bodies into wells.",,,https://en.wikipedia.org/wiki/Hoshang_Amini,2026-07-05T16:17:54.960869+00:00
10,Yang Xinhai,"[""Yang Zhiya (\u6768\u679d\u7259) Yang Liu (\u6768\u67f3)""]",https://upload.wikimedia.org/wikipedia/en/thumb/b/bc/YangXinhai.png/250px-YangXinhai.png,1968,China,67,67,"{""proved_victims"": 67, ""possible_victims"": 67, ""female"": 0, ""male"": 0, ""under_18"": 0, ""18_30"": 0, ""31_45"": 0, ""46_60"": 0, ""above_60"": 0, ""major_occupation"": null}",China,,,"[""Anhui Hebei Henan Shandong""]",,,,"Yang Xinhai ( Chinese : 杨新海 ; pinyin : Yáng Xīnhǎi ; 17 July 1968 – 14 February 2004) was a Chinese serial killer and mass murderer who confessed to committing 67 murders and 23 rapes between 2000 and 2003. He was sentenced to death and executed . He is the most prolific known serial killer in China since the establishment of the People's Republic of China in 1949. The South China Morning Post dubbed Yang the ""Monster Killer"".",,,https://en.wikipedia.org/wiki/Yang_Xinhai,2026-07-05T16:17:56.940442+00:00
11,Abul Djabar,,,,Abul Djabar Afghanistan,65,300,"{""proved_victims"": 65, ""possible_victims"": 300, ""female"": 0, ""male"": 0, ""under_18"": 0, ""18_30"": 0, ""31_45"": 0, ""46_60"": 0, ""above_60"": 0, ""major_occupation"": null}",Kingdom of Afghanistan,,,,,Murder,Sexual desire,"Abul Djabar (died 21 October 1970) was an Afghan serial killer and rapist who killed at least 65 people, and was suspected of murdering over 300 men and boys.",,,https://en.wikipedia.org/wiki/Abul_Djabar,2026-07-05T16:17:59.113902+00:00
12,Samuel Little,"[""Samuel McDowell The Choke-and-Stroke Killer Mr. Sam""]",https://upload.wikimedia.org/wikipedia/commons/thumb/9/9c/Samuel_Little.webp/250px-Samuel_Little.webp.png,1940,U.S.,60,93,"{""proved_victims"": 60, ""possible_victims"": 93, ""female"": 0, ""male"": 0, ""under_18"": 0, ""18_30"": 0, ""31_45"": 0, ""46_60"": 0, ""above_60"": 0, ""major_occupation"": null}",United States,,,"[""California"", ""Texas"", ""and Ohio (convicted) Sixteen others (accused) [ 1 ]""]",,Murder (8 counts),,"Samuel Little ( né McDowell ; June 7, 1940 – December 30, 2020) was an American serial killer who was convicted of 8 murders and confessed to committing 93 murders, across 19 states, between 1970 and 2005. The FBI 's Violent Criminal Apprehension Program has confirmed his involvement in at least 60 murders, the largest number of confirmed victims for any serial killer in American history. Little provided sketches for 26 of his victims, although not all have been linked to known murders. His crime spree stretched across the country, with a concentration of murders in Miami and Los Angeles .",,,https://en.wikipedia.org/wiki/Samuel_Little,2026-07-05T16:18:01.457495+00:00
13,William Unek,"[""William s/o Unek [ 3 ] William Onek [ 4 ] William Uneko [ 5 ]""]",https://upload.wikimedia.org/wikipedia/commons/thumb/5/53/William_Unek_alt.png/250px-William_Unek_alt.png,,Protectorate of Uganda,58,58,"{""proved_victims"": 58, ""possible_victims"": 58, ""female"": 0, ""male"": 0, ""under_18"": 0, ""18_30"": 0, ""31_45"": 0, ""46_60"": 0, ""above_60"": 0, ""major_occupation"": null}",Belgian Congo Tanganyika Territory,,,"[""Orientale Province (Congo) Lake Province (Tanganyika)""]",,Murder,,William Unek (died 20 February 1957) was a Ugandan serial mass murderer who killed a total of 58 people in two separate spree killings in the Belgian Congo (modern-day Democratic Republic of Congo) and Tanganyika Territory (modern-day Tanzania) during the mid-1950s.,,,https://en.wikipedia.org/wiki/William_Unek,2026-07-05T16:18:03.744567+00:00
14,Mohammed Bijeh,,,,Iran [ 1 ],54,54,"{""proved_victims"": 54, ""possible_victims"": 54, ""female"": 0, ""male"": 0, ""under_18"": 0, ""18_30"": 0, ""31_45"": 0, ""46_60"": 0, ""above_60"": 0, ""major_occupation"": null}",Iran,,,,,Murder,,"Mohammed Bijeh ( Persian : محمد بيجه ; died 16 March 2005) was an Iranian serial killer . He was convicted of raping and killing around 20 children, mostly boys, and was sentenced to 100 lashes followed by execution . All the boys were between 8 and 15 years old. The murder of children around Tehran was recognized as the largest criminal case in contemporary Iranian history and provoked national outrage. Bijeh's execution, which was witnessed by over 5,000 people, including children, sparked debates on whether public executions should continue within the country.",,,https://en.wikipedia.org/wiki/Mohammed_Bijeh,2026-07-05T16:18:06.644707+00:00
15,Andrei Chikatilo,"[""The Butcher of Rostov The Forest Strip Killer [ 1 ] The Red Ripper The Rostov Ripper [ 2 ]""]",https://upload.wikimedia.org/wikipedia/en/thumb/5/59/Chikatilo-mugshot.jpg/250px-Chikatilo-mugshot.jpg,1936,Soviet Union,53,56,"{""proved_victims"": 53, ""possible_victims"": 56, ""female"": 0, ""male"": 0, ""under_18"": 0, ""18_30"": 0, ""31_45"": 0, ""46_60"": 0, ""above_60"": 0, ""major_occupation"": null}",Soviet Union,,,,,Executed by shooting,Sexual sadism Rage [ 3 ],"Andrei Romanovich Chikatilo ( Russian : Андрей Романович Чикатило ; Ukrainian : Андрій Романович Чикатило , romanized : Andrii Romanovych Chykatylo ; 16 October 1936 – 14 February 1994) was a Ukrainian-born Soviet serial killer nicknamed "" the Butcher of Rostov "", "" the Rostov Ripper "", and "" the Red Ripper "" who sexually assaulted , murdered, and mutilated at least fifty-two women and children between 1978 and 1990 in the Russian SFSR , the Ukrainian SSR , and the Uzbek SSR .",,,https://en.wikipedia.org/wiki/Andrei_Chikatilo,2026-07-05T16:18:09.097173+00:00
16,Anatoly Onoprienko,"[""The Beast of Ukraine The Terminator Citizen O""]",https://upload.wikimedia.org/wikipedia/en/6/6e/Anatoly_Onoprienko_mugshot.jpg,1959,USSR,52,52,"{""proved_victims"": 52, ""possible_victims"": 52, ""female"": 0, ""male"": 0, ""under_18"": 0, ""18_30"": 0, ""31_45"": 0, ""46_60"": 0, ""above_60"": 0, ""major_occupation"": null}",Soviet Union [ nb 1 ] Ukraine,,,,,Murders,"Misanthropy , robbery","Anatoly Yuriyovych Onoprienko ( Ukrainian : Анатолій Юрійович Онопрієнко ; Russian : Анато́лий Ю́рьевич Оноприе́нко , Anatoly Yuryevich Onoprienko; 25 July 1959 – 27 August 2013) was a Soviet and Ukrainian serial killer and mass murderer . Known by the nicknames The Beast of Ukraine , The Terminator , and Citizen O , Onoprienko confessed to killing fifty-two people upon being apprehended in April 1996.",,,https://en.wikipedia.org/wiki/Anatoly_Onoprienko,2026-07-05T16:18:12.064758+00:00
17,Florisvaldo de Oliveira,,,1958,Brazil [ 1 ],50,50,"{""proved_victims"": 50, ""possible_victims"": 50, ""female"": 0, ""male"": 0, ""under_18"": 0, ""18_30"": 0, ""31_45"": 0, ""46_60"": 0, ""above_60"": 0, ""major_occupation"": null}",Brazil,,,,,Murder,,"Florisvaldo de Oliveira (November 18, 1958 – September 26, 2012), commonly known as ""Cabo Bruno"" , was a Brazilian vigilante , serial killer and former officer of the Military Police of São Paulo State accused of more than 50 murders on the outskirts of São Paulo during the 1980s. Considered ""one of the most controversial characters in crime journalism"", he initially admitted to these deaths, but later denied them in his testimony.",,,https://en.wikipedia.org/wiki/Florisvaldo_de_Oliveira,2026-07-05T16:18:14.573483+00:00
18,Gary Ridgway,"[""The Green River Killer The Green River Strangler""]",https://upload.wikimedia.org/wikipedia/commons/thumb/5/5c/Gary_Ridgway_Mugshot_11302001.jpg/250px-Gary_Ridgway_Mugshot_11302001.jpg,1949,U.S.,49,71,"{""proved_victims"": 49, ""possible_victims"": 71, ""female"": 0, ""male"": 0, ""under_18"": 0, ""18_30"": 0, ""31_45"": 0, ""46_60"": 0, ""above_60"": 0, ""major_occupation"": null}",United States,,,"[""Washington"", ""Oregon""]",,,,"Gary Leon Ridgway (born February 18, 1949), known as the Green River Killer or the Green River Strangler , is an American serial killer who was convicted of murdering forty-nine women between 1982 and 1998 in the northwestern United States . At the time of his arrest in 2001, he was believed to be the most prolific serial killer in United States history, according to confirmed murders.",,,https://en.wikipedia.org/wiki/Gary_Ridgway,2026-07-05T16:18:16.731103+00:00
19,Alexander Pichushkin,"[""The Bittsa Park Maniac The Chessboard Killer""]",https://upload.wikimedia.org/wikipedia/en/thumb/d/d9/AlexanderPichushkin.jpg/250px-AlexanderPichushkin.jpg,1974,USSR,49,60,"{""proved_victims"": 49, ""possible_victims"": 60, ""female"": 0, ""male"": 0, ""under_18"": 0, ""18_30"": 0, ""31_45"": 0, ""46_60"": 0, ""above_60"": 0, ""major_occupation"": null}",Russia,,,,,,"To kill 64 people, the number of squares on a chessboard To surpass Andrei Chikatilo in number of victims Theorised frontal cortex damage from childhood injury","Alexander Yuryevich Pichushkin ( Russian : Алекса́ндр Ю́рьевич Пичу́шкин ; born 9 April 1974), also known as the Chessboard Killer ( Убийца с шахматной доской ) and the Bittsa Park Maniac ( Битцевский маньяк ), is a Russian serial killer and former warehouse worker who is believed to have killed at least forty-nine people, and possibly as many as sixty, between 1992 and 2006. Pichushkin was active in Moscow 's Bittsa Park , where a number of the victims' bodies were found. On 29 October 2007, he was sentenced to life imprisonment . At time of imprisonment, he was unmarried with no children.",,,https://en.wikipedia.org/wiki/Alexander_Pichushkin,2026-07-05T16:18:19.028332+00:00
20,Wang Qiang,,https://upload.wikimedia.org/wikipedia/en/thumb/1/17/WangQiangPhoto.png/250px-WangQiangPhoto.png,1975,China,45,60,"{""proved_victims"": 45, ""possible_victims"": 60, ""female"": 0, ""male"": 0, ""under_18"": 0, ""18_30"": 0, ""31_45"": 0, ""46_60"": 0, ""above_60"": 0, ""major_occupation"": null}",China,,,,,,,"Wang Qiang ( simplified Chinese : 王强 ; traditional Chinese : 王強 ; pinyin : Wáng Qiáng ; 16 January 1975 – 17 November 2005) was a Chinese serial killer , rapist , and robber from Liaoning , and one of the most prolific murderers in Chinese history.",,,https://en.wikipedia.org/wiki/Wang_Qiang_(serial_killer),2026-07-05T16:18:21.877104+00:00
21,Ahmad Suradji,"[""Dukun AS Nasib Kelewang Datuk Maringgi The Sorcerer""]",,1949,Indonesia,42,42,"{""proved_victims"": 42, ""possible_victims"": 42, ""female"": 0, ""male"": 0, ""under_18"": 0, ""18_30"": 0, ""31_45"": 0, ""46_60"": 0, ""above_60"": 0, ""major_occupation"": null}",Indonesia,,,,,Murder (42 counts),,"Ahmad Suradji (10 January 1949 – 10 July 2008), also known as Dukun AS , Nasib Klewang , and Datuk Maringgi , was an Indonesian serial killer who admitted to murdering 42 girls and women between 1986 and 1997. Suradji's victims, ranging in age between 11 and 30, were strangled after being buried in the ground up to their waists as part of a ritual . He buried his victims in a sugarcane plantation near his home with their heads facing his house, which he believed would give him extra power.",,,https://en.wikipedia.org/wiki/Ahmad_Suradji,2026-07-05T16:18:24.118265+00:00
22,Raman Raghav,"[""The Ripper Sindhi Dalwai Talwai Anna Thambi Veluswami Psycho Raman [ 1 ]""]",https://upload.wikimedia.org/wikipedia/en/thumb/6/6c/Raman-Raghav.jpg/250px-Raman-Raghav.jpg,1929,India),41,41,"{""proved_victims"": 41, ""possible_victims"": 41, ""female"": 0, ""male"": 0, ""under_18"": 0, ""18_30"": 0, ""31_45"": 0, ""46_60"": 0, ""above_60"": 0, ""major_occupation"": null}",India,,,,,Murder,,"Raman Raghav , also known as Sindhi Talwai, Anna, Thambi, and Veluswami, was a serial killer active during the mid-1960s. Raghav went on a killing spree for over three years, with the first round of murders taking place in 1965 and 1966 when 19 people were attacked, and a second round of killings taking place in 1968. He was caught by Maharashtra Police on 27 August. Raghav was spared a death sentence due to mental illness, and was subsequently sentenced to life imprisonment; he died in hospital while in prison custody in 1995.",,,https://en.wikipedia.org/wiki/Raman_Raghav,2026-07-05T16:18:26.081154+00:00
23,Moses Sithole,"[""The ABC Killer The South African Strangler The Gauteng Killer""]",,1964,South Africa,38,76,"{""proved_victims"": 38, ""possible_victims"": 76, ""female"": 0, ""male"": 0, ""under_18"": 0, ""18_30"": 0, ""31_45"": 0, ""46_60"": 0, ""above_60"": 0, ""major_occupation"": null}",South Africa,,,"[""Atteridgeville"", ""Gauteng"", ""Johannesburg""]",,,,"Moses Sithole (born 17 November 1964) is a South African serial killer and rapist who committed the ABC Murders . It is believed that he is so named because they began in Atteridgeville , continued in Boksburg and finished in Cleveland , a suburb of Johannesburg . However, many other sources state that the cities were not in that order, rather beginning in Cleveland, continuing in Boksburg and finishing in Atteridgeville. This has not been denied nor confirmed.",,,https://en.wikipedia.org/wiki/Moses_Sithole,2026-07-05T16:18:28.072896+00:00
24,Serhiy Tkach,"[""Pavlohrad Maniac [ 1 ] Polohy Maniac [ 3 ]""]",https://upload.wikimedia.org/wikipedia/commons/thumb/a/a3/%D0%A1%D0%B5%D1%80%D0%B3%D0%B5%D0%B9_%D0%A2%D0%BA%D0%B0%D1%87_%D0%BF%D0%BE%D0%BB%D0%BE%D0%B3%D0%BE%D0%B2%D1%81%D0%BA%D0%B8%D0%B9_%D0%BC%D0%B0%D0%BD%D1%8C%D1%8F%D0%BA.jpg/250px-%D0%A1%D0%B5%D1%80%D0%B3%D0%B5%D0%B9_%D0%A2%D0%BA%D0%B0%D1%87_%D0%BF%D0%BE%D0%BB%D0%BE%D0%B3%D0%BE%D0%B2%D1%81%D0%BA%D0%B8%D0%B9_%D0%BC%D0%B0%D0%BD%D1%8C%D1%8F%D0%BA.jpg,1952,Soviet Union [ 2 ],37,100,"{""proved_victims"": 37, ""possible_victims"": 100, ""female"": 0, ""male"": 0, ""under_18"": 0, ""18_30"": 0, ""31_45"": 0, ""46_60"": 0, ""above_60"": 0, ""major_occupation"": null}",Soviet Union Ukraine,,,,,,,"Serhiy Fedorovych Tkach ( Ukrainian : Сергій Федорович Ткач , Russian : Серге́й Фёдорович Ткач ; 15 September 1952 – 4 November 2018), also known as Sergey Tkach , was a Russian-born Ukrainian police officer and serial killer who was convicted for the killings of thirty-seven women and girls in the Soviet Union and later Ukraine between 1980 and 2005.",,,https://en.wikipedia.org/wiki/Serhiy_Tkach,2026-07-05T16:18:30.731378+00:00
25,Gennady Mikhasevich,,https://upload.wikimedia.org/wikipedia/en/thumb/2/24/GennadyModestovichMikhasevich.jpg/250px-GennadyModestovichMikhasevich.jpg,1947,Byelorussian SSR,36,43,"{""proved_victims"": 36, ""possible_victims"": 43, ""female"": 0, ""male"": 0, ""under_18"": 0, ""18_30"": 0, ""31_45"": 0, ""46_60"": 0, ""above_60"": 0, ""major_occupation"": null}",Soviet Union,,,,,Murder with aggravating circumstances (x36),,"Gennady Modestovich Mikhasevich ( Belarusian : Генадзь Мадэставіч Міхасевіч ; 7 April 1947 – 25 September 1987) was a Soviet serial killer and serial rapist known as the "" Vitebsk Strangler "" (Віцебскі душыцель), who murdered a minimum of 36 women in Vitebsk , Polotsk and the surrounding regions in the Byelorussian SSR between 1971 and 1985.",,,https://en.wikipedia.org/wiki/Gennady_Mikhasevich,2026-07-05T16:18:33.400943+00:00
26,Hadj Mohammed Mesfewi,,https://upload.wikimedia.org/wikipedia/commons/thumb/9/92/Hadj_Mohammed_Mesfewi.png/250px-Hadj_Mohammed_Mesfewi.png,,Morocco,36,36,"{""proved_victims"": 36, ""possible_victims"": 36, ""female"": 0, ""male"": 0, ""under_18"": 0, ""18_30"": 0, ""31_45"": 0, ""46_60"": 0, ""above_60"": 0, ""major_occupation"": null}",Morocco,,,,,Murder,,"Hadj Mohammed Mesfewi (died June 13, 1906), called the "" Marrakesh Arch-Killer"", was a Moroccan serial killer who murdered at least 36 women.",,,https://en.wikipedia.org/wiki/Hadj_Mohammed_Mesfewi,2026-07-05T16:18:35.847087+00:00
27,Vera Renczi,,,1903,Romania,35,35,"{""proved_victims"": 35, ""possible_victims"": 35, ""female"": 0, ""male"": 0, ""under_18"": 0, ""18_30"": 0, ""31_45"": 0, ""46_60"": 0, ""above_60"": 0, ""major_occupation"": null}",Romania Yugoslavia Hungary (alleged),,,,,Life imprisonment,,"Vera Renczi (dubbed the Black Widow , Ms. Poison or Chatelaine of Berkerekul ), was a Romanian serial killer who was charged with poisoning 35 individuals including her two husbands, multiple lovers, and her son with arsenic during the 1920s.",,,https://en.wikipedia.org/wiki/Vera_Renczi,2026-07-05T16:18:38.228178+00:00
